tweet_id,dog_photos_url,photos_count,dog_breed,confidence(%),tweet_timestamp,tweet_content,tweet_url,dog_name,dog_rating,dog_stage,favorite_count,retweet_count,retweet_favorite_sum
795400264262053889,https://pbs.twimg.com/media/CwnUUGTWIAE8sFR.jpg,2,Golden Retriever,92.5494,2016-11-06 22:59:35,This is Brody. He's trying to make the same face as the football. 12/10 https://t.co/2H4MfOGlpQ,"https://twitter.com/dog_rates/status/795400264262053889/photo/1,https://twitter.com/dog_rates/status/795400264262053889/photo/1,https://twitter.com/dog_rates/status/795400264262053889/photo/1,https://twitter.com/dog_rates/status/795400264262053889/photo/1",Brody,120.0,Not Specified,11270,3323,14593
795464331001561088,https://pbs.twimg.com/ext_tw_video_thumb/795464066940764160/pu/img/jPkMMQXdydb7CqFX.jpg,1,Golden Retriever,19.3082,2016-11-07 03:14:10,Elder doggo does a splash. Both 13/10 incredible stuff https://t.co/gBUDjdEcqz,https://twitter.com/dog_rates/status/795464331001561088/video/1,No Name,130.0,doggo,55683,27728,83411
796031486298386433,https://pbs.twimg.com/media/CwwSaWJWIAASuoY.jpg,1,Golden Retriever,89.3775,2016-11-08 16:47:50,This is Daisy. She's here to make your day better. 13/10 mission h*ckin successful https://t.co/PbgvuD0qIL,https://twitter.com/dog_rates/status/796031486298386433/photo/1,Daisy,130.0,Not Specified,12071,4284,16355
796080075804475393,https://pbs.twimg.com/media/Cww-msrXcAAxm3K.jpg,1,Chow,97.3846,2016-11-08 20:00:55,This is Yogi. He's 98% floof. Snuggable af. 12/10 https://t.co/opoXKxmfFm,https://twitter.com/dog_rates/status/796080075804475393/photo/1,Yogi,120.0,Not Specified,9469,2703,12172
796116448414461957,https://pbs.twimg.com/media/CwxfrguUUAA1cbl.jpg,1,Cardigan,70.0182,2016-11-08 22:25:27,I didn't believe it at first but now I can see that voter fraud is a serious h*ckin issue. 11/10 https://t.co/7i0bDMbrVN,https://twitter.com/dog_rates/status/796116448414461957/photo/1,No Name,110.00000000000001,Not Specified,10139,2813,12952
796149749086875649,https://pbs.twimg.com/media/Cwx99rpW8AMk_Ie.jpg,1,Golden Retriever,60.02760000000001,2016-11-09 02:29:25,RT @dog_rates: This is Ruby. She just turned on the news. Officially terrified. 11/10 deep breaths Ruby https://t.co/y5KarNXWXt,"https://twitter.com/dog_rates/status/796149749086875649/photo/1,https://twitter.com/dog_rates/status/796149749086875649/photo/1,https://twitter.com/dog_rates/status/796149749086875649/photo/1,https://twitter.com/dog_rates/status/796149749086875649/photo/1",Ruby,110.00000000000001,Not Specified,36177,16628,52805
796387464403357696,https://pbs.twimg.com/media/Cw1WKu1UQAAvWsu.jpg,1,Pekinese,46.1164,2016-11-09 16:22:22,This is Snicku. He's having trouble reading because he's a dog. Glasses only helped a little. Nap preferred. 12/10 would snug well https://t.co/cVLUasbKA5,"https://twitter.com/dog_rates/status/796387464403357696/photo/1,https://twitter.com/dog_rates/status/796387464403357696/photo/1",Snicku,120.0,Not Specified,12334,4861,17195
796484825502875648,https://pbs.twimg.com/media/Cw2uty8VQAAB0pL.jpg,1,Cocker Spaniel,11.6924,2016-11-09 22:49:15,Here's a sleepy doggo that requested some assistance. 12/10 would carry everywhere https://t.co/bvkkqOjNDV,https://twitter.com/dog_rates/status/796484825502875648/photo/1,No Name,120.0,doggo,8472,2042,10514
796759840936919040,https://pbs.twimg.com/media/Cw6o1JQXcAAtP78.jpg,1,American Staffordshire Terrier,46.3996,2016-11-10 17:02:03,Say hello to Romeo. He was just told that it's too cold for the pool. H*ckin nonsense. 11/10 would help fill up https://t.co/6hx7ur6sNI,"https://twitter.com/dog_rates/status/796759840936919040/photo/1,https://twitter.com/dog_rates/status/796759840936919040/photo/1",Romeo,110.00000000000001,Not Specified,13256,3562,16818
796865951799083009,https://pbs.twimg.com/media/Cw8JWZ2UsAAJOZ6.jpg,1,Cardigan,83.91290000000001,2016-11-11 00:03:42,This is Tyr. He's just checking on you. Nifty af tongue slip. 12/10 would absolutely pet https://t.co/Jgnuiyvq06,https://twitter.com/dog_rates/status/796865951799083009/photo/1,Tyr,120.0,Not Specified,8564,2198,10762
797236660651966464,https://pbs.twimg.com/media/CxBafisWQAAtJ1X.jpg,2,Collie,76.7005,2016-11-12 00:36:46,This is Pancake. She loves Batman and winks like a h*ckin champ. 12/10 real crowd pleaser https://t.co/6kqsAjJNhi,"https://twitter.com/dog_rates/status/797236660651966464/photo/1,https://twitter.com/dog_rates/status/797236660651966464/photo/1",Pancake,120.0,Not Specified,22328,7726,30054
797545162159308800,https://pbs.twimg.com/media/CxFzFAAUAAA5C9z.jpg,1,Pembroke,95.4089,2016-11-12 21:02:38,This is Cassie. She steals things. Guilt increases slightly each time. 12/10 would forgive almost immediately https://t.co/Ia19irLwyB,"https://twitter.com/dog_rates/status/797545162159308800/photo/1,https://twitter.com/dog_rates/status/797545162159308800/photo/1,https://twitter.com/dog_rates/status/797545162159308800/photo/1,https://twitter.com/dog_rates/status/797545162159308800/photo/1",Cassie,120.0,Not Specified,16198,5656,21854
797971864723324932,https://pbs.twimg.com/media/CxL3IWeVEAAAIE2.jpg,1,American Staffordshire Terrier,48.9845,2016-11-14 01:18:12,Here's a helicopter pupper. He takes off at random. H*ckin hard to control. 12/10 rare af https://t.co/GRWPgNKt2z,"https://twitter.com/dog_rates/status/797971864723324932/photo/1,https://twitter.com/dog_rates/status/797971864723324932/photo/1",No Name,120.0,pupper,13018,3652,16670
798209839306514432,https://pbs.twimg.com/media/CxPPnCYWIAAo_ao.jpg,1,Pekinese,52.4583,2016-11-14 17:03:50,This is Cooper. His bow tie was too heavy for the front so he moved it to the side. Balanced af now. 13/10 https://t.co/jG1PAFkB81,https://twitter.com/dog_rates/status/798209839306514432/photo/1,Cooper,130.0,Not Specified,11548,2954,14502
798925684722855936,https://pbs.twimg.com/media/CxZaqh_WQAA7lY3.jpg,1,West Highland White Terrier,53.9463,2016-11-16 16:28:21,This is Shadow. He's a firm believer that they're all good dogs. H*ckin passionate about it too. 11/10 I stand with Shadow https://t.co/8yvpacwBcu,https://twitter.com/dog_rates/status/798925684722855936/photo/1,Shadow,110.00000000000001,Not Specified,8246,1663,9909
798933969379225600,https://pbs.twimg.com/media/CxZiLcLXUAApMVy.jpg,1,Siberian Husky,70.3224,2016-11-16 17:01:16,This is Iroh. He's in a predicament. 12/10 someone help him https://t.co/KJAKO2kXsL,"https://twitter.com/dog_rates/status/798933969379225600/photo/1,https://twitter.com/dog_rates/status/798933969379225600/photo/1",Iroh,120.0,Not Specified,14712,5203,19915
799063482566066176,https://pbs.twimg.com/media/CxbX_n2WIAAHaLS.jpg,2,Norfolk Terrier,33.4436,2016-11-17 01:35:54,This is Mister. He only wears the most fashionable af headwear. 11/10 h*ckin stylish https://t.co/BXJFKOVnJm,"https://twitter.com/dog_rates/status/799063482566066176/photo/1,https://twitter.com/dog_rates/status/799063482566066176/photo/1,https://twitter.com/dog_rates/status/799063482566066176/photo/1,https://twitter.com/dog_rates/status/799063482566066176/photo/1",Mister,110.00000000000001,Not Specified,9058,2863,11921
799297110730567681,https://pbs.twimg.com/media/CxeseRgUoAM_SQK.jpg,1,Malamute,98.50280000000001,2016-11-17 17:04:16,This is Jeffrey. He's quite the jokester. Takes it too far sometimes. Still 11/10 would pet https://t.co/YDtZcAiMAf,"https://twitter.com/dog_rates/status/799297110730567681/photo/1,https://twitter.com/dog_rates/status/799297110730567681/photo/1",Jeffrey,110.00000000000001,Not Specified,11065,3227,14292
799422933579902976,https://pbs.twimg.com/media/Cxge6AdUQAAvXLB.jpg,1,Miniature Pinscher,58.363,2016-11-18 01:24:14,This is Longfellow (prolly sophisticated). He's a North Appalachian Oatzenjammer. Concerned about wrinkled feets. 12/10 would hug softly https://t.co/bpLuQuxzHZ,https://twitter.com/dog_rates/status/799422933579902976/photo/1,Longfellow,120.0,Not Specified,8965,2213,11178
799757965289017345,https://pbs.twimg.com/media/CxlPnoSUcAEXf1i.jpg,1,Border Collie,44.2534,2016-11-18 23:35:32,This is Sobe. She's a h*ckin happy doggo. Only one leg tho. Must have good balance. 13/10 would smile back https://t.co/OiH8PaOxB1,"https://twitter.com/dog_rates/status/799757965289017345/photo/1,https://twitter.com/dog_rates/status/799757965289017345/photo/1,https://twitter.com/dog_rates/status/799757965289017345/photo/1,https://twitter.com/dog_rates/status/799757965289017345/photo/1",Sobe,130.0,doggo,9390,2506,11896
800141422401830912,https://pbs.twimg.com/media/CxqsX-8XUAAEvjD.jpg,3,Golden Retriever,93.8048,2017-01-15 01:45:15,RT @dog_rates: This is Peaches. She's the ultimate selfie sidekick. Super sneaky tongue slip appreciated. 13/10 https://t.co/pbKOesr8Tg,"https://twitter.com/dog_rates/status/800141422401830912/photo/1,https://twitter.com/dog_rates/status/800141422401830912/photo/1,https://twitter.com/dog_rates/status/800141422401830912/photo/1,https://twitter.com/dog_rates/status/800141422401830912/photo/1,https://twitter.com/dog_rates/status/800141422401830912/photo/1,https://twitter.com/dog_rates/status/800141422401830912/photo/1",Peaches,130.0,Not Specified,17092,2980,20072
800388270626521089,https://pbs.twimg.com/media/CxuM3oZW8AEhO5z.jpg,2,Golden Retriever,35.986000000000004,2016-11-20 17:20:08,This is Doc. He takes time out of every day to worship our plant overlords. 12/10 quite the floofer https://t.co/azMneS6Ly5,"https://twitter.com/dog_rates/status/800388270626521089/photo/1,https://twitter.com/dog_rates/status/800388270626521089/photo/1,https://twitter.com/dog_rates/status/800388270626521089/photo/1",Doc,120.0,floofer,12456,3265,15721
800513324630806528,https://pbs.twimg.com/media/Cxv-nkJUoAAhzMt.jpg,1,Pembroke,82.89040000000001,2016-11-21 01:37:04,This is Chef. Chef loves everyone and wants everyone to love each other. 11/10 https://t.co/ILHGs0e6Dm,https://twitter.com/dog_rates/status/800513324630806528/photo/1,Chef,110.00000000000001,Not Specified,14685,3495,18180
800751577355128832,https://pbs.twimg.com/media/CxzXOyBW8AEu_Oi.jpg,2,Cocker Spaniel,77.1984,2016-11-21 17:23:47,Say hello to Mauve and Murphy. They're rather h*ckin filthy. Preferred nap over bath. Both 12/10 https://t.co/4UwCTW3lXG,"https://twitter.com/dog_rates/status/800751577355128832/photo/1,https://twitter.com/dog_rates/status/800751577355128832/photo/1,https://twitter.com/dog_rates/status/800751577355128832/photo/1",Mauve,120.0,Not Specified,11701,3214,14915
801115127852503040,https://pbs.twimg.com/media/Cx4h7zHUsAAqaJd.jpg,1,Dalmatian,82.3356,2016-11-22 17:28:25,This is Bones. He's being haunted by another doggo of roughly the same size. 12/10 deep breaths pupper everything's fine https://t.co/55Dqe0SJNj,"https://twitter.com/dog_rates/status/801115127852503040/photo/1,https://twitter.com/dog_rates/status/801115127852503040/photo/1",Bones,120.0,doggo,8992,2429,11421
801167903437357056,https://pbs.twimg.com/media/Cx5R8wPVEAALa9r.jpg,1,Cocker Spaniel,74.022,2016-12-12 02:21:26,RT @dog_rates: This is Milo. I would do terrible things for Milo. 13/10 https://t.co/R6wJyC2Tey,"https://twitter.com/dog_rates/status/801167903437357056/photo/1,https://twitter.com/dog_rates/status/801167903437357056/photo/1",Milo,130.0,Not Specified,27386,6961,34347
801538201127157760,https://pbs.twimg.com/media/Cx-itFWWIAAZu7l.jpg,1,Pembroke,55.0506,2016-11-23 21:29:33,This is Wallace. He'll be your chau-fur this evening. 12/10 eyes on the road Wallace https://t.co/p1RD39XjUe,https://twitter.com/dog_rates/status/801538201127157760/photo/1,Wallace,120.0,Not Specified,9141,2391,11532
801958328846974976,https://pbs.twimg.com/media/CyEg2AXUsAA1Qpf.jpg,1,Staffordshire Bullterrier,32.7887,2016-11-25 01:18:59,This is Ronnie. He hopes you're having a great day. Nifty tongue slip. 12/10 would pat head approvingly https://t.co/4fY2bsAm65,https://twitter.com/dog_rates/status/801958328846974976/photo/1,Ronnie,120.0,Not Specified,8608,1992,10600
802239329049477120,https://pbs.twimg.com/media/CyIgaTEVEAA-9zS.jpg,2,Eskimo Dog,48.2498,2016-11-25 19:55:35,This is Loki. He'll do your taxes for you. Can also make room in your budget for all the things you bought today. 12/10 what a puppo https://t.co/5oWrHCWg87,"https://twitter.com/dog_rates/status/802239329049477120/photo/1,https://twitter.com/dog_rates/status/802239329049477120/photo/1",Loki,120.0,puppo,10132,3040,13172
802265048156610565,https://pbs.twimg.com/media/CyI3zXgWEAACQfB.jpg,1,Labrador Retriever,89.71620000000001,2016-11-25 21:37:47,"Like doggo, like pupper version 2. Both 11/10 https://t.co/9IxWAXFqze",https://twitter.com/dog_rates/status/802265048156610565/photo/1,No Name,110.00000000000001,doggo,7039,1573,8612
802572683846291456,https://pbs.twimg.com/media/CyNPmJgXcAECPuB.jpg,1,Golden Retriever,61.0171,2016-11-26 18:00:13,This is Winnie. She's h*ckin ferocious. Dandelion doesn't even see her coming. 12/10 would pet with caution https://t.co/EFfLCP7oQv,https://twitter.com/dog_rates/status/802572683846291456/photo/1,Winnie,120.0,Not Specified,9959,2926,12885
802952499103731712,https://pbs.twimg.com/media/CySpCSHXcAAN-qC.jpg,1,Chow,94.4032,2016-11-27 19:09:28,This is Marley. She's having a ruff day. Pretty pupset. 12/10 would assist https://t.co/yLm7hQ6UXh,https://twitter.com/dog_rates/status/802952499103731712/photo/1,Marley,120.0,Not Specified,10085,2336,12421
803276597545603072,https://pbs.twimg.com/media/CyXPzXRWgAAvd1j.jpg,1,Pembroke,45.7086,2016-11-28 16:37:19,This is Winston. His selfie game is legendary. Will steal your girl with a single snap. 11/10 handsome as h*ck https://t.co/jxQhxoPsgL,https://twitter.com/dog_rates/status/803276597545603072/photo/1,Winston,110.00000000000001,Not Specified,11207,2887,14094
803638050916102144,https://pbs.twimg.com/ext_tw_video_thumb/803638023904559104/pu/img/vxm0Htm5iIV7EOAQ.jpg,1,Labrador Retriever,37.2776,2016-11-29 16:33:36,Pupper hath acquire enemy. 13/10 https://t.co/ns9qoElfsX,https://twitter.com/dog_rates/status/803638050916102144/video/1,No Name,130.0,pupper,12270,4828,17098
803773340896923648,https://pbs.twimg.com/media/CyeTku-XcAALkBd.jpg,2,Miniature Pinscher,81.7066,2016-11-30 01:31:12,This is Diogi. He fell in the pool as soon as he was brought home. Clumsy puppo. 12/10 would pet until dry https://t.co/ZxeRjMKaWt,"https://twitter.com/dog_rates/status/803773340896923648/photo/1,https://twitter.com/dog_rates/status/803773340896923648/photo/1,https://twitter.com/dog_rates/status/803773340896923648/photo/1,https://twitter.com/dog_rates/status/803773340896923648/photo/1",Diogi,120.0,puppo,11203,3220,14423
804738756058218496,https://pbs.twimg.com/media/CysBn-lWIAAoRx1.jpg,1,Tibetan Mastiff,91.579,2016-12-02 17:27:25,This is Django. He accidentally opened the front facing camera. Did him quite the frighten. 12/10 https://t.co/kQVQoOW9NZ,https://twitter.com/dog_rates/status/804738756058218496/photo/1,Django,120.0,Not Specified,15326,4480,19806
805207613751304193,https://pbs.twimg.com/media/CyysDQlVIAAYgrl.jpg,1,Pembroke,24.4705,2016-12-04 00:30:29,This is Shooter. He's doing quite the snowy zoom. 12/10 https://t.co/lHy4Xbyhd9,https://twitter.com/dog_rates/status/805207613751304193/photo/1,Shooter,120.0,Not Specified,8680,1972,10652
805520635690676224,https://pbs.twimg.com/media/Cy3IvdZXgAUoEaj.jpg,1,Malinois,64.3147,2016-12-04 21:14:20,This is Zeke the Wonder Dog. He never let that poor man keep his frisbees. One of the Spartans all time greatest receivers. 13/10 RIP Zeke https://t.co/zacX7S6GyJ,"https://twitter.com/dog_rates/status/805520635690676224/photo/1,https://twitter.com/dog_rates/status/805520635690676224/photo/1,https://twitter.com/dog_rates/status/805520635690676224/photo/1,https://twitter.com/dog_rates/status/805520635690676224/photo/1",Zeke,130.0,Not Specified,6368,1905,8273
805826884734976000,https://pbs.twimg.com/ext_tw_video_thumb/805826823359631360/pu/img/yr_fF0TZCR-B70p2.jpg,1,Siberian Husky,24.8926,2016-12-05 17:31:15,This is Duke. He is not a fan of the pupporazzi. 12/10 https://t.co/SgpBVYIL18,https://twitter.com/dog_rates/status/805826884734976000/video/1,Duke,120.0,puppo,7335,2132,9467
805932879469572096,https://pbs.twimg.com/media/Cy8_qt0UUAAHuuN.jpg,1,Norwegian Elkhound,65.7967,2016-12-06 00:32:26,This is Major. He put on a tie for his first real walk. Only a little crooked. Can also drool upwards. H*ckin talented. 12/10 https://t.co/Zcwr8LgoO8,https://twitter.com/dog_rates/status/805932879469572096/photo/1,Major,120.0,Not Specified,9178,2209,11387
806542213899489280,https://pbs.twimg.com/media/CzFp3FNW8AAfvV8.jpg,1,Vizsla,93.8617,2016-12-07 16:53:43,This is Waffles. He's concerned that the dandruff shampoo he just bought is faulty. 11/10 tragic af https://t.co/BCB87qUU0h,https://twitter.com/dog_rates/status/806542213899489280/photo/1,Waffles,110.00000000000001,Not Specified,11363,2752,14115
807010152071229440,https://pbs.twimg.com/media/CzMTcZoXUAEKqEt.jpg,1,Golden Retriever,61.0807,2016-12-08 23:53:08,This is Lennon. He's a Boopershnoop Pupperdoop. Quite rare. Exceptionally pettable. 12/10 would definitely boop that shnoop https://t.co/fhgP6vSfhX,https://twitter.com/dog_rates/status/807010152071229440/photo/1,Lennon,120.0,pupper,14514,4418,18932
807106840509214720,https://pbs.twimg.com/ext_tw_video_thumb/807106774843039744/pu/img/8XZg1xW35Xp2J6JW.jpg,1,Chihuahua,50.537,2017-03-18 00:15:37,RT @dog_rates: This is Stephan. He just wants to help. 13/10 such a good boy https://t.co/DkBYaCAg2d,"https://twitter.com/dog_rates/status/807106840509214720/video/1,https://twitter.com/dog_rates/status/807106840509214720/video/1",Stephan,130.0,Not Specified,107015,56625,163640
807621403335917568,https://pbs.twimg.com/media/CzU_YVGUUAA3Xsd.jpg,3,Golden Retriever,87.3233,2016-12-10 16:22:02,This is Ollie Vue. He was a 3 legged pupper on a mission to overcome everything. This is very hard to write. 14/10 we will miss you Ollie https://t.co/qTRY2qX9y4,"https://twitter.com/dog_rates/status/807621403335917568/photo/1,https://twitter.com/dog_rates/status/807621403335917568/photo/1,https://twitter.com/dog_rates/status/807621403335917568/photo/1,https://twitter.com/dog_rates/status/807621403335917568/photo/1",Ollie,140.0,pupper,16236,4288,20524
808001312164028416,https://pbs.twimg.com/media/CzaY5UdUoAAC91S.jpg,1,Labrador Retriever,73.0959,2016-12-11 17:31:39,This is Cooper. He likes to stick his tongue out at you and then laugh about it. 12/10 quite the jokester https://t.co/O9iGgvfuzl,"https://twitter.com/dog_rates/status/808001312164028416/photo/1,https://twitter.com/dog_rates/status/808001312164028416/photo/1",Cooper,120.0,Not Specified,14015,4098,18113
808106460588765185,https://pbs.twimg.com/media/Czb4iFRXgAIUMiN.jpg,1,Golden Retriever,42.6183,2016-12-12 00:29:28,Here we have Burke (pupper) and Dexter (doggo). Pupper wants to be exactly like doggo. Both 12/10 would pet at same time https://t.co/ANBpEYHaho,https://twitter.com/dog_rates/status/808106460588765185/photo/1,No Name,120.0,pupper,9701,2525,12226
808501579447930884,https://pbs.twimg.com/media/Czhf4XtVQAAIqpd.jpg,2,Airedale,45.42390000000001,2016-12-13 02:39:32,This is Koda. He dug a hole and then sat in it because why not. Unamused by the bath that followed. 12/10 https://t.co/SQhyqrr8px,"https://twitter.com/dog_rates/status/808501579447930884/photo/1,https://twitter.com/dog_rates/status/808501579447930884/photo/1",Koda,120.0,Not Specified,12595,3007,15602
808838249661788160,https://pbs.twimg.com/media/CzmSFlKUAAAQOjP.jpg,1,Rottweiler,36.953,2016-12-14 00:57:20,This is Ito. He'll be your uber driver tonight. Currently adjusting the mirrors. 13/10 incredibly h*ckin responsible https://t.co/Zrrcw29o13,https://twitter.com/dog_rates/status/808838249661788160/photo/1,Ito,130.0,Not Specified,11271,3536,14807
809084759137812480,https://pbs.twimg.com/media/CzpyM41UoAE1b2w.jpg,1,Vizsla,91.1412,2016-12-14 17:16:53,"This is Wallace. You said you brushed your teeth but he checked your toothbrush and it was bone dry. 11/10 not pupset, just disappointed https://t.co/nadm8yWZ4h",https://twitter.com/dog_rates/status/809084759137812480/photo/1,Wallace,110.00000000000001,Not Specified,14685,4046,18731
809220051211603969,https://pbs.twimg.com/media/CzrtWDbWEAAmIhy.jpg,1,Pomeranian,81.95110000000001,2017-02-10 21:54:58,RT @dog_rates: This is Kyro. He's a Stratocumulus Flop. Tongue ejects at random. Serious h*ckin condition. Still 12/10 would pet passionate…,"https://twitter.com/dog_rates/status/809220051211603969/photo/1,https://twitter.com/dog_rates/status/809220051211603969/photo/1",Kyro,120.0,Not Specified,22246,6554,28800
809448704142938112,https://pbs.twimg.com/media/Czu9RiwVEAA_Okk.jpg,1,Greater Swiss Mountain Dog,37.5415,2016-12-15 17:23:04,"I call this one ""A Blep by the Sea"" 12/10 https://t.co/EMdnCugNbo",https://twitter.com/dog_rates/status/809448704142938112/photo/1,No Name,120.0,Not Specified,7727,1696,9423
810254108431155201,https://pbs.twimg.com/media/Cz6Z0DgWIAAfdvp.jpg,1,Staffordshire Bullterrier,29.255599999999998,2017-02-07 03:04:22,"RT @dog_rates: This is Gus. He likes to be close to you, which is good because you want to be close to Gus. 12/10 would boop then pet https…",https://twitter.com/dog_rates/status/810254108431155201/photo/1,Gus,120.0,Not Specified,16380,3901,20281
810284430598270976,https://pbs.twimg.com/media/Cz61ZD4W8AAcJEU.jpg,1,Malamute,62.0768,2016-12-18 00:43:57,This is Phil. He's a father. A very good father too. 13/10 everybody loves Phil https://t.co/9p6ECXJMMu,"https://twitter.com/dog_rates/status/810284430598270976/photo/1,https://twitter.com/dog_rates/status/810284430598270976/photo/1",Phil,130.0,Not Specified,39640,13369,53009
810657578271330305,https://pbs.twimg.com/media/C0AIwgVXAAAc1Ig.jpg,1,Malamute,75.3521,2016-12-19 01:26:42,This is Pavlov. His floatation device has failed him. He's quite pupset about it. 11/10 would rescue https://t.co/MXd0AGDsRJ,https://twitter.com/dog_rates/status/810657578271330305/photo/1,Pavlov,110.00000000000001,Not Specified,12192,3057,15249
810896069567610880,https://pbs.twimg.com/media/C0DhpcrUAAAnx88.jpg,1,Flat-Coated Retriever,82.08040000000001,2016-12-19 17:14:23,"This is Hunter. He just found out he needs braces. Requesting an orthodogtist stat. 11/10 you're fine Hunter, everything's fine https://t.co/zW1o0W4AYV","https://twitter.com/dog_rates/status/810896069567610880/photo/1,https://twitter.com/dog_rates/status/810896069567610880/photo/1,https://twitter.com/dog_rates/status/810896069567610880/photo/1",Hunter,110.00000000000001,Not Specified,10093,2090,12183
811386762094317568,https://pbs.twimg.com/media/C0Kf9PtWQAEW4sE.jpg,1,Pembroke,80.4177,2016-12-21 01:44:13,This is Craig. That's actually a normal sized fence he's stuck on. H*ckin massive pupper. 11/10 someone help him https://t.co/aAUXzoxaBy,https://twitter.com/dog_rates/status/811386762094317568/photo/1,Craig,110.00000000000001,pupper,23302,7444,30746
811627233043480576,https://pbs.twimg.com/media/C0N6opSXAAAkCtN.jpg,1,Beagle,39.628,2016-12-21 17:39:46,This is Augie. He's a savage. Doesn't give a h*ck about your garden. Still 10/10 would forgive then pet https://t.co/IU8S0n4oxn,https://twitter.com/dog_rates/status/811627233043480576/photo/1,Augie,100.0,Not Specified,14265,3650,17915
811744202451197953,https://pbs.twimg.com/media/C0PlCQjXAAA9TIh.jpg,1,Pekinese,38.6082,2016-12-22 01:24:33,This is Halo. She likes watermelon. 13/10 https://t.co/TZkiQZqwA6,https://twitter.com/dog_rates/status/811744202451197953/photo/1,Halo,130.0,Not Specified,8429,1884,10313
811985624773361665,https://pbs.twimg.com/media/C0TAnZIUAAAADKs.jpg,1,Staffordshire Bullterrier,61.05729999999999,2016-12-22 17:23:53,Say hello to Ted. He accidentally opened the front facing camera. 11/10 h*ckin unpupared https://t.co/sIB5C6FDop,https://twitter.com/dog_rates/status/811985624773361665/photo/1,Ted,110.00000000000001,Not Specified,8102,1647,9749
812372279581671427,https://pbs.twimg.com/media/C0YgO3DW8AAz98O.jpg,2,Golden Retriever,78.48729999999999,2016-12-23 19:00:19,This is Moe. He's a fetty woof. Got a cardboard cutout of himself for Christmas. 13/10 inspirational af https://t.co/gCnAeL2mvT,"https://twitter.com/dog_rates/status/812372279581671427/photo/1,https://twitter.com/dog_rates/status/812372279581671427/photo/1",Moe,130.0,Not Specified,15224,4252,19476
812709060537683968,https://pbs.twimg.com/media/C0dSk98WEAALyya.jpg,1,Irish Setter,32.6873,2016-12-24 17:18:34,This is Brandi and Harley. They are practicing their caroling for later. Both 12/10 festive af https://t.co/AbBDuGZUpp,https://twitter.com/dog_rates/status/812709060537683968/photo/1,Brandi,120.0,Not Specified,7373,1665,9038
812781120811126785,https://pbs.twimg.com/media/C0eUHfWUAAANEYr.jpg,1,Bull Mastiff,98.9316,2016-12-24 22:04:54,This is Swagger. He's the Cleveland Browns ambassador. Hype as h*ck after that first win today. 10/10 https://t.co/lXFM1l22bG,"https://twitter.com/dog_rates/status/812781120811126785/photo/1,https://twitter.com/dog_rates/status/812781120811126785/photo/1,https://twitter.com/dog_rates/status/812781120811126785/photo/1",Swagger,100.0,Not Specified,8380,2191,10571
813051746834595840,https://pbs.twimg.com/media/C0iKPZIXUAAbDYV.jpg,1,Golden Retriever,91.48039999999999,2016-12-25 16:00:16,This is Bauer. He had nothing to do with the cookies that disappeared. 13/10 very good boy https://t.co/AIMF8ouzvl,https://twitter.com/dog_rates/status/813051746834595840/photo/1,Bauer,130.0,Not Specified,23337,8503,31840
813066809284972545,https://pbs.twimg.com/media/C0iX8OOVEAEIpMC.jpg,1,Toy Terrier,77.64,2016-12-25 17:00:08,This is Tyr. He is disgusted by holiday traffic. Just trying to get to Christmas brunch on time. 12/10 hurry up pup https://t.co/syuTXARdtN,https://twitter.com/dog_rates/status/813066809284972545/photo/1,Tyr,120.0,Not Specified,8865,2276,11141
