tweet_id,dog_photos_url,photos_count,dog_breed,confidence(%),tweet_timestamp,tweet_content,tweet_url,dog_name,dog_rating,dog_stage,favorite_count,retweet_count,retweet_favorite_sum
679511351870550016,https://pbs.twimg.com/media/CW4b-GUWYAAa8QO.jpg,1,Chihuahua,76.1972,2015-12-23 03:58:25,Say hello to William. He makes fun of others because he's terrified of his own deep-seated insecurities. 7/10 https://t.co/bwuV6FlRxr,https://twitter.com/dog_rates/status/679511351870550016/photo/1,William,70.0,Not Specified,3711,1461,5172
679722016581222400,https://pbs.twimg.com/media/CW7bkW6WQAAksgB.jpg,1,Boxer,45.9604,2015-12-23 17:55:32,This is Mike. He is a Jordanian Frito Pilates. Frowning because he can't see directly in front of him. 8/10 https://t.co/NL5QJwdEpF,https://twitter.com/dog_rates/status/679722016581222400/photo/1,Mike,80.0,Not Specified,1817,539,2356
679736210798047232,https://pbs.twimg.com/media/CW7oelWWcAAhyzz.jpg,1,French Bulldog,31.9139,2015-12-23 18:51:56,This pup's name is Sabertooth (parents must be cool). Ears for days. Jumps unannounced. 9/10 would pet diligently https://t.co/iazoiNUviP,https://twitter.com/dog_rates/status/679736210798047232/photo/1,No Name,90.0,Not Specified,2311,918,3229
679777920601223168,https://pbs.twimg.com/media/CW8OYajUMAAPRoF.jpg,1,Bloodhound,52.881899999999995,2015-12-23 21:37:40,This is Rinna. She's melting. 10/10 get inside pupper https://t.co/PA0czwucsb,https://twitter.com/dog_rates/status/679777920601223168/photo/1,Rinna,100.0,pupper,3390,1281,4671
679828447187857408,https://pbs.twimg.com/media/CW88XN4WsAAlo8r.jpg,3,Chihuahua,34.6545,2016-09-16 16:24:19,RT @dog_rates: Everybody look at this beautiful pupper 13/10 https://t.co/hyAC5Hq9GC,"https://twitter.com/dog_rates/status/679828447187857408/photo/1,https://twitter.com/dog_rates/status/679828447187857408/photo/1,https://twitter.com/dog_rates/status/679828447187857408/photo/1,https://twitter.com/dog_rates/status/679828447187857408/photo/1,https://twitter.com/dog_rates/status/679828447187857408/photo/1,https://twitter.com/dog_rates/status/679828447187857408/photo/1",No Name,130.0,pupper,39726,15839,55565
679844490799091713,https://pbs.twimg.com/media/CW9K9VeVAAE0j-x.jpg,1,Airedale,90.3832,2015-12-24 02:02:12,This is Willie. He's floating away and needs your assistance. Please someone help Willie. 10/10 https://t.co/MJqygWqt8X,https://twitter.com/dog_rates/status/679844490799091713/photo/1,Willie,100.0,Not Specified,2593,887,3480
679862121895714818,https://pbs.twimg.com/media/CW9a_h1WwAApmAy.jpg,1,Entlebucher,52.320600000000006,2015-12-24 03:12:15,"""Dammit hooman I'm jus trynna lik the fler"" 11/10 https://t.co/eRZRI8OTj7",https://twitter.com/dog_rates/status/679862121895714818/photo/1,No Name,110.00000000000001,Not Specified,2678,706,3384
680100725817409536,https://pbs.twimg.com/media/CW-loUBWYAAn2Cb.jpg,1,Golden Retriever,69.89609999999999,2015-12-24 19:00:23,This pupper is not coming inside until she catches a snowflake on her tongue. 11/10 the determination is palpable https://t.co/lvMYbmKq8H,https://twitter.com/dog_rates/status/680100725817409536/photo/1,No Name,110.00000000000001,pupper,3891,1554,5445
680115823365742593,https://pbs.twimg.com/media/CXBBurSWMAELewi.jpg,1,Pug,99.9365,2015-12-24 20:00:22,This is Ozzy. He woke up 2 minutes before he had to be ready for the Christmas party. 9/10 classic Ozzy https://t.co/Kt9vmw0Fap,https://twitter.com/dog_rates/status/680115823365742593/photo/1,Ozzy,90.0,Not Specified,2972,1028,4000
680130881361686529,https://pbs.twimg.com/media/CXBPbVtWAAA2Vus.jpg,1,Maltese Dog,19.9121,2015-12-24 21:00:12,This is Reggie. His Santa hat is a little big. 10/10 he's still having fun https://t.co/w0dcGXq7qK,https://twitter.com/dog_rates/status/680130881361686529/photo/1,Reggie,100.0,Not Specified,2519,1078,3597
680145970311643136,https://pbs.twimg.com/media/CXBdJxLUsAAWql2.jpg,1,Miniature Poodle,45.7117,2015-12-24 22:00:10,Say hello to Kawhi. He was doing fine until his hat fell off. He got it back though. 10/10 deep breaths pupper https://t.co/N5pM6WBx7e,"https://twitter.com/dog_rates/status/680145970311643136/photo/1,https://twitter.com/dog_rates/status/680145970311643136/photo/1,https://twitter.com/dog_rates/status/680145970311643136/photo/1",Kawhi,100.0,pupper,3955,1972,5927
680161097740095489,https://pbs.twimg.com/media/CXBq6RPWkAAaNuU.jpg,1,Bluetick,26.868100000000002,2015-12-24 23:00:17,Meet Goliath. He's an example of irony. Head is phenomenally round. Wants to be an ornament. 12/10 would hug gently https://t.co/72Dil0Aktw,https://twitter.com/dog_rates/status/680161097740095489/photo/1,Goliath,120.0,Not Specified,2538,828,3366
680191257256136705,https://pbs.twimg.com/media/CXCGVXyWsAAAVHE.jpg,1,Brittany Spaniel,73.3253,2015-12-25 01:00:07,Here's a sleepy Christmas pupper 11/10 https://t.co/KXg0f8GNQ9,https://twitter.com/dog_rates/status/680191257256136705/photo/1,No Name,110.00000000000001,pupper,2356,577,2933
680473011644985345,https://pbs.twimg.com/media/CXGGlzvWYAArPfk.jpg,1,Lakeland Terrier,79.6694,2015-12-25 19:39:43,"This is Hector. He thinks he's a hammer. Silly Hector. You're a pupper, not a hammer. 10/10 https://t.co/OdUFuZIXiI",https://twitter.com/dog_rates/status/680473011644985345/photo/1,Hector,100.0,pupper,2778,844,3622
680494726643068929,https://pbs.twimg.com/media/CXGaVxOWAAADjhF.jpg,1,Kuvasz,43.8627,2015-12-25 21:06:00,Here we have uncovered an entire battalion of holiday puppers. Average of 11.26/10 https://t.co/eNm2S6p9BD,https://twitter.com/dog_rates/status/680494726643068929/photo/1,No Name,112.6,pupper,1879,542,2421
680497766108381184,https://pbs.twimg.com/media/CXGdG0aWcAEbOO1.jpg,1,Chihuahua,53.8354,2015-12-25 21:18:05,Meet Percy. He's a Latvian Yuletide Heineken. Refuses to take off sweater. Kinda feisty. 12/10 would keep in pocket https://t.co/QGM5Fcuv7s,https://twitter.com/dog_rates/status/680497766108381184/photo/1,Percy,120.0,Not Specified,4639,2162,6801
680609293079592961,https://pbs.twimg.com/media/CXICiB9UwAE1sKY.jpg,1,French Bulldog,70.0764,2015-12-26 04:41:15,This is Brody. That is his chair. He loves his chair. Never leaves it. 9/10 might be stuck actually https://t.co/WvJRg0XJit,https://twitter.com/dog_rates/status/680609293079592961/photo/1,Brody,90.0,Not Specified,2906,816,3722
680801747103793152,https://pbs.twimg.com/media/CXKxkseW8AAjAMY.jpg,1,Pug,99.67200000000001,2015-12-26 17:25:59,Great picture here. Dog on the right panicked &amp; forgot about his tongue. Middle green dog must've fainted. All 10/10 https://t.co/31npKUAox0,https://twitter.com/dog_rates/status/680801747103793152/photo/1,No Name,100.0,Not Specified,2600,925,3525
680836378243002368,https://pbs.twimg.com/media/CXLREjOW8AElfk6.jpg,3,Pembroke,42.7781,2015-12-26 19:43:36,This is Ellie. She's secretly ferocious. 12/10 very deadly pupper https://t.co/BF4BW8LUgb,"https://twitter.com/dog_rates/status/680836378243002368/photo/1,https://twitter.com/dog_rates/status/680836378243002368/photo/1,https://twitter.com/dog_rates/status/680836378243002368/photo/1",Ellie,120.0,pupper,3766,1513,5279
680889648562991104,https://pbs.twimg.com/media/CXMBhXfWEAA4mMI.jpg,1,Shetland Sheepdog,87.6337,2015-12-26 23:15:17,This is Cheesy. It's her birthday. She's patiently waiting to eat her party muffin. 9/10 happy birthday pup https://t.co/cH2H7mch2H,https://twitter.com/dog_rates/status/680889648562991104/photo/1,Cheesy,90.0,Not Specified,1945,418,2363
680913438424612864,https://pbs.twimg.com/media/CXMXKKHUMAA1QN3.jpg,1,Pomeranian,61.56779999999999,2015-12-27 00:49:49,Meet Griswold. He's dapper as hell. Already pumped for next Christmas. 11/10 https://t.co/5NrpNDyFzN,https://twitter.com/dog_rates/status/680913438424612864/photo/1,Griswold,110.00000000000001,Not Specified,2609,705,3314
680934982542561280,https://pbs.twimg.com/media/CXMqwIQWcAA2iE0.jpg,1,Labrador Retriever,78.43979999999999,2015-12-27 02:15:25,Say hello to Sadie. She's a Tortellini Sidewinder. Very jubilant pup. Seems loyal. Leaves on point. 10/10 petable af https://t.co/g2bTu4ayPl,https://twitter.com/dog_rates/status/680934982542561280/photo/1,Sadie,100.0,Not Specified,2285,497,2782
681193455364796417,https://pbs.twimg.com/media/CXQV03pWYAAVniz.jpg,1,Pomeranian,99.2619,2015-12-27 19:22:30,This is Aspen. He's astronomically fluffy. I wouldn't stop petting this dog if the world was ending around me 11/10 https://t.co/oBlgL9nxpx,"https://twitter.com/dog_rates/status/681193455364796417/photo/1,https://twitter.com/dog_rates/status/681193455364796417/photo/1",Aspen,110.00000000000001,Not Specified,4077,1691,5768
681231109724700672,https://pbs.twimg.com/media/CXQ4EwQWwAEVaUf.jpg,1,Irish Setter,40.6047,2015-12-27 21:52:07,I just love this pic. 11/10 this pupper is going places https://t.co/P16uhh1PbI,https://twitter.com/dog_rates/status/681231109724700672/photo/1,No Name,110.00000000000001,pupper,2629,540,3169
681261549936340994,https://pbs.twimg.com/media/CXRTw_5WMAAUDVp.jpg,1,Tibetan Terrier,38.210100000000004,2015-12-27 23:53:05,Say hello to Panda. He's a Quackadilly Shooster. Not amused by your fake ball throwing motion. 9/10 would hug lots https://t.co/wL1iDvbcVk,https://twitter.com/dog_rates/status/681261549936340994/photo/1,Panda,90.0,Not Specified,1597,308,1905
681281657291280384,https://pbs.twimg.com/media/CXRmDfWWMAADCdc.jpg,1,Saint Bernard,99.883,2015-12-28 01:12:59,Meet Sarge. His parents signed him up for dancing lessons but his true passion is roller coasters 11/10 very petable https://t.co/KvVoBIgkje,https://twitter.com/dog_rates/status/681281657291280384/photo/1,Sarge,110.00000000000001,Not Specified,3520,1258,4778
681320187870711809,https://pbs.twimg.com/media/CXSJGAQUQAAoG9Q.jpg,1,Samoyed,36.2596,2015-12-28 03:46:05,This is Glacier. He's a very happy pup. Loves to sing in the sunlight. 11/10 https://t.co/jTBPqKgkz7,https://twitter.com/dog_rates/status/681320187870711809/photo/1,Glacier,110.00000000000001,Not Specified,2918,863,3781
681523177663676416,https://pbs.twimg.com/media/CXVBtX_WwAEuqbP.jpg,1,Norfolk Terrier,20.5067,2016-07-13 18:42:44,RT @dog_rates: This is Carly. She's actually 2 dogs fused together. Very innovative. Probably has superpowers. 12/10 for double dog https:/…,https://twitter.com/dog_rates/status/681523177663676416/photo/1,Carly,120.0,Not Specified,15749,6620,22369
681579835668455424,https://pbs.twimg.com/media/CXV1Ot_W8AEpkQO.jpg,1,Rottweiler,76.0671,2015-12-28 20:57:50,This is Apollo. He thought you weren't coming back so he had a mental breakdown. 8/10 we've all been there https://t.co/ojUBrDCHLT,https://twitter.com/dog_rates/status/681579835668455424/photo/1,Apollo,80.0,Not Specified,3893,1489,5382
681610798867845120,https://pbs.twimg.com/media/CXWRZBgWkAEHMea.jpg,1,Toy Poodle,82.17040000000001,2015-12-28 23:00:52,*collapses* 12/10 https://t.co/C7M8mnzHIK,https://twitter.com/dog_rates/status/681610798867845120/photo/1,No Name,120.0,Not Specified,2100,533,2633
681654059175129088,https://pbs.twimg.com/media/CXW4wGHWsAE_eBD.jpg,1,Pomeranian,80.0538,2015-12-29 01:52:46,This is Toffee. He's a happy pupper. Appears dangerously fluffy. Extraordinarily spherical. 12/10 would pet firmly https://t.co/oEXEKt3MHu,https://twitter.com/dog_rates/status/681654059175129088/photo/1,Toffee,120.0,pupper,2903,1045,3948
681694085539872773,https://pbs.twimg.com/media/CXXdJ7CVAAALu23.jpg,1,Toy Poodle,92.0992,2016-11-20 04:06:37,RT @dog_rates: This is Bo. He's a Benedoop Cumbersnatch. Seems frustrated with own feet. Portable as hell. 11/10 very solid pupper https://…,https://twitter.com/dog_rates/status/681694085539872773/photo/1,Bo,110.00000000000001,pupper,14010,4581,18591
681891461017812993,https://pbs.twimg.com/media/CXaQqGbWMAAKEgN.jpg,1,Chihuahua,20.357,2015-12-29 17:36:07,Say hello to Charlie. He's scholarly af. Quite intimidating with all his pupper knowledge 10/10 even built that fire https://t.co/9KThv6z8u5,https://twitter.com/dog_rates/status/681891461017812993/photo/1,Charlie,100.0,pupper,2706,951,3657
681981167097122816,https://pbs.twimg.com/media/CXbiQHmWcAAt6Lm.jpg,1,Labrador Retriever,45.257700000000014,2015-12-29 23:32:35,This is Jimothy. He's a Trinidad Poliwhirl. Father was a velociraptor. Exceptionally unamused. 12/10 would adopt https://t.co/VwdIk0OwVx,https://twitter.com/dog_rates/status/681981167097122816/photo/1,Jimothy,120.0,Not Specified,3043,1161,4204
682032003584274432,https://pbs.twimg.com/media/CXcQfUNUQAEwFoQ.jpg,1,Schipperke,99.7953,2015-12-30 02:54:35,This is Ulysses. He likes holding hands and his eyes are magic. 11/10 https://t.co/gPmJHmtgak,https://twitter.com/dog_rates/status/682032003584274432/photo/1,Ulysses,110.00000000000001,Not Specified,7223,2294,9517
682259524040966145,https://pbs.twimg.com/media/CXffar9WYAArfpw.jpg,1,Siberian Husky,43.967,2015-12-30 17:58:40,Meet Jax. He's an Iglesias Hufflepoof. Quite the jokester. Takes it too far sometimes. Can be very hurtful. 9/10 https://t.co/i5TeG0KYcW,https://twitter.com/dog_rates/status/682259524040966145/photo/1,Jax,90.0,Not Specified,4578,1375,5953
682389078323662849,https://pbs.twimg.com/media/CXhVKtvW8AAyiyK.jpg,1,Curly-Coated Retriever,48.2288,2015-12-31 02:33:29,"Meet Brody. He's a Downton Abbey Falsetto. Addicted to grating cheese. He says he can stop but we know he can't
9/10 https://t.co/vBeiQq6SaZ",https://twitter.com/dog_rates/status/682389078323662849/photo/1,Brody,90.0,Not Specified,1828,518,2346
682393905736888321,https://pbs.twimg.com/media/CXhZom1UwAA4Zz6.jpg,1,Vizsla,65.7275,2015-12-31 02:52:40,This is Kreg. He's riding an invisible jet ski. 11/10 that's downright legendary https://t.co/BA5AV5dx6Y,https://twitter.com/dog_rates/status/682393905736888321/photo/1,Kreg,110.00000000000001,Not Specified,2441,773,3214
682429480204398592,https://pbs.twimg.com/media/CXh5_dDWQAIbU-J.jpg,1,Whippet,59.4701,2015-12-31 05:14:01,"I know we joke around on here, but this is getting really frustrating. We rate dogs. Not T-Rex. Thank you... 8/10 https://t.co/5aFw7SWyxU",https://twitter.com/dog_rates/status/682429480204398592/photo/1,No Name,80.0,Not Specified,3769,1320,5089
682638830361513985,https://pbs.twimg.com/media/CXk4W0qWYAMEMEs.jpg,1,English Springer,44.0781,2015-12-31 19:05:54,I have no words. Just a magnificent pup. 12/10 https://t.co/viwWHZgX8j,"https://twitter.com/dog_rates/status/682638830361513985/photo/1,https://twitter.com/dog_rates/status/682638830361513985/photo/1,https://twitter.com/dog_rates/status/682638830361513985/photo/1,https://twitter.com/dog_rates/status/682638830361513985/photo/1",No Name,120.0,Not Specified,2266,675,2941
682662431982772225,https://pbs.twimg.com/media/CXlN1-EWMAQdwXK.jpg,1,Beagle,41.382400000000004,2015-12-31 20:39:41,Meet Joey and Izzy. Joey only has one ear that works and Izzy wants 2015 to be over already. Both great pups. 11/10s https://t.co/WgQTIQ93BB,https://twitter.com/dog_rates/status/682662431982772225/photo/1,Joey,110.00000000000001,Not Specified,3326,1207,4533
682750546109968385,https://pbs.twimg.com/media/CXmd_bsWkAEEXck.jpg,1,English Setter,94.71979999999999,2016-01-01 02:29:49,Meet Taco. He's a speckled Garnier Fructis. Loves to shadow box. Ears out of control. Friend clearly impressed 9/10 https://t.co/85X1GHohFr,https://twitter.com/dog_rates/status/682750546109968385/photo/1,Taco,90.0,Not Specified,1674,494,2168
683030066213818368,https://pbs.twimg.com/media/CXqcOHCUQAAugTB.jpg,1,Boxer,72.2218,2016-01-01 21:00:32,This is Lulu. She's contemplating all her unreached 2015 goals and daydreaming of a more efficient tomorrow. 10/10 https://t.co/h3ScYuz77J,https://twitter.com/dog_rates/status/683030066213818368/photo/1,Lulu,100.0,Not Specified,2370,832,3202
683098815881154561,https://pbs.twimg.com/media/CXrawAhWkAAWSxC.jpg,1,Golden Retriever,88.98479999999999,2016-01-02 01:33:43,aahhhhkslaldhwnxmzbbs 12/10 for being da smooshiest https://t.co/UOPdXmUz4H,https://twitter.com/dog_rates/status/683098815881154561/photo/1,No Name,120.0,Not Specified,2361,736,3097
683111407806746624,https://pbs.twimg.com/media/CXrmMSpUwAAdeRj.jpg,1,Cocker Spaniel,90.1392,2016-01-02 02:23:45,This is Larry. He thought the New Year's parties were tonight. 10/10 poor pupper. Maybe next year https://t.co/h3X0jK8MVM,https://twitter.com/dog_rates/status/683111407806746624/photo/1,Larry,100.0,pupper,3736,1034,4770
683142553609318400,https://pbs.twimg.com/media/CXsChyjW8AQJ16C.jpg,1,Leonberg,60.585100000000004,2016-01-02 04:27:31,Meet Brandy. She's a member of the Bloods. Menacing criminal pupper. Soft spot for flowers tho. 9/10 pet w caution https://t.co/hhIA3coiAJ,https://twitter.com/dog_rates/status/683142553609318400/photo/1,Brandy,90.0,pupper,3162,1173,4335
683357973142474752,https://pbs.twimg.com/media/CXvGbWeWMAcRbyJ.jpg,1,Pembroke,40.6509,2016-01-02 18:43:31,"""Have a seat, son. There are some things we need to discuss"" 10/10 https://t.co/g4G5tvfTVd",https://twitter.com/dog_rates/status/683357973142474752/photo/1,No Name,100.0,Not Specified,3238,1059,4297
683391852557561860,https://pbs.twimg.com/media/CXvlQ2zW8AAE0tp.jpg,1,French Bulldog,99.2833,2016-11-16 00:38:54,"RT @dog_rates: Say hello to Jack (pronounced ""Kevin""). He's a Virgo Episcopalian. Can summon rainbows. 11/10 magical as hell https://t.co/Y…",https://twitter.com/dog_rates/status/683391852557561860/photo/1,Jack,110.00000000000001,Not Specified,8356,2702,11058
683449695444799489,https://pbs.twimg.com/media/CXwZ3pbWsAAriTv.jpg,1,Lakeland Terrier,30.3512,2016-01-03 00:47:59,I just want to be friends with this dog. Appears to be into the sports. A true brobean. 10/10 would introduce to mom https://t.co/1Z7Q6svWpe,https://twitter.com/dog_rates/status/683449695444799489/photo/1,No Name,100.0,Not Specified,4290,1837,6127
683462770029932544,https://pbs.twimg.com/media/CXwlw9MWsAAc-JB.jpg,1,Italian Greyhound,39.956,2016-01-03 01:39:57,"""Hello forest pupper I am house pupper welcome to my abode"" (8/10 for both) https://t.co/qFD8217fUT",https://twitter.com/dog_rates/status/683462770029932544/photo/1,No Name,80.0,pupper,2676,761,3437
683481228088049664,https://pbs.twimg.com/media/CXw2jSpWMAAad6V.jpg,1,Keeshond,50.895100000000006,2016-01-03 02:53:17,Meet Banjo. He's a Peppercorn Shoop Da Whoop. Nails look lethal. Skeptical of luminescent orb 11/10 stay woke pupper https://t.co/H7NZFumpKq,https://twitter.com/dog_rates/status/683481228088049664/photo/1,Banjo,110.00000000000001,pupper,2878,1118,3996
683498322573824003,https://pbs.twimg.com/media/CXxGGOsUwAAr62n.jpg,1,Airedale,94.53620000000001,2016-01-03 04:01:13,This is Griffin. He's desperate for both a physical and emotion connection. 11/10 I'd hug the hell out of Griffin https://t.co/ObWcOEekt0,https://twitter.com/dog_rates/status/683498322573824003/photo/1,Griffin,110.00000000000001,Not Specified,3469,1095,4564
683742671509258241,https://pbs.twimg.com/media/CX0kVRxWYAAWWZi.jpg,1,Pembroke,89.5279,2016-01-03 20:12:10,Meet Sebastian. He's a womanizer. Romantic af. Always covered in flower petals. Also a poet. 11/10 dreamy as hell https://t.co/eoL1bCpWCg,https://twitter.com/dog_rates/status/683742671509258241/photo/1,Sebastian,110.00000000000001,Not Specified,7162,3781,10943
683773439333797890,https://pbs.twimg.com/media/CX1AUQ2UAAAC6s-.jpg,1,Miniature Pinscher,7.28852,2016-01-03 22:14:26,This is Buddy. He's gaining strength. Currently an F4 tornado with wind speeds up to 260mph. Very devastating. 9/10 https://t.co/qipZbshNsR,https://twitter.com/dog_rates/status/683773439333797890/photo/1,Buddy,90.0,Not Specified,3684,1533,5217
683828599284170753,https://pbs.twimg.com/media/CX1ye7HUMAADDzh.jpg,1,Malamute,57.7376,2016-01-04 01:53:37,Breathtaking pupper here. Should be on the cover of Dogue. Top-notch tongue. Appears considerably fluffy. 12/10 https://t.co/Eeh3yfdglS,https://twitter.com/dog_rates/status/683828599284170753/photo/1,No Name,120.0,pupper,3053,1195,4248
683834909291606017,https://pbs.twimg.com/ext_tw_video_thumb/683834825250320385/pu/img/yZdrqMlyky4KGOu6.jpg,1,Maltese Dog,73.8449,2016-01-04 02:18:42,Here we see a faulty pupper. Might need to replace batteries. Try turning off &amp; back on again. 9/10 would still pet https://t.co/O1E4AtHVxO,https://twitter.com/dog_rates/status/683834909291606017/video/1,No Name,90.0,pupper,2880,1265,4145
683852578183077888,https://pbs.twimg.com/media/CX2ISqSWYAAEtCF.jpg,1,Toy Poodle,55.135200000000005,2016-01-04 03:28:54,"Say hello to Tiger. He's a penbroke (little dog pun for ya, no need to applaud I know it was good) 10/10 good dog https://t.co/Yei0HzS3JN",https://twitter.com/dog_rates/status/683852578183077888/photo/1,Tiger,100.0,Not Specified,2111,397,2508
683857920510050305,https://pbs.twimg.com/media/CX2NJmRWYAAxz_5.jpg,1,Bluetick,17.4738,2016-01-04 03:50:08,Meet Sadie. She fell asleep on the beach and her friends buried her. 10/10 can't trust fellow puppers these days https://t.co/LoKVvc1xAW,https://twitter.com/dog_rates/status/683857920510050305/photo/1,Sadie,100.0,pupper,4163,1262,5425
684097758874210310,https://pbs.twimg.com/media/CX5nR5oWsAAiclh.jpg,1,Labrador Retriever,62.78560000000001,2016-01-04 19:43:10,Say hello to Lupe. This is how she sleeps. 10/10 impressive really https://t.co/Fz6iZWlk8C,https://twitter.com/dog_rates/status/684097758874210310/photo/1,Lupe,100.0,Not Specified,4515,1621,6136
684177701129875456,https://pbs.twimg.com/media/CX6v_JOWsAE0beZ.jpg,1,Chow,33.4783,2016-01-05 01:00:50,This is Kulet. She's very proud of the flower she picked. Loves it dearly. 10/10 now I want a flower https://t.co/myUUwqJIs7,https://twitter.com/dog_rates/status/684177701129875456/photo/1,Kulet,100.0,Not Specified,2215,764,2979
684188786104872960,https://pbs.twimg.com/media/CX66EiJWkAAVjA-.jpg,1,Kelpie,53.7782,2016-01-05 01:44:52,"""Yo Boomer I'm taking a selfie, grab your stick""
""Ok make sure to get this rad hole I just dug in there""

Both 10/10 https://t.co/e0gbl9VFpA",https://twitter.com/dog_rates/status/684188786104872960/photo/1,No Name,100.0,Not Specified,3831,1343,5174
684195085588783105,https://pbs.twimg.com/media/CX6_y6OU0AAl3v2.jpg,1,Chihuahua,37.9365,2016-01-05 02:09:54,This is Tino. He really likes corndogs. 9/10 https://t.co/cUxGtnBfc2,https://twitter.com/dog_rates/status/684195085588783105/photo/1,Tino,90.0,Not Specified,2108,595,2703
684222868335505415,https://pbs.twimg.com/media/CX7Y_ByWwAEJdUy.jpg,1,Soft-Coated Wheaten Terrier,79.11819999999999,2016-01-05 04:00:18,Someone help the girl is being mugged. Several are distracting her while two steal her shoes. Clever puppers 121/110 https://t.co/1zfnTJLt55,https://twitter.com/dog_rates/status/684222868335505415/photo/1,No Name,110.00000000000001,pupper,4225,1563,5788
684225744407494656,https://pbs.twimg.com/media/CX7br3HWsAAQ9L1.jpg,2,Golden Retriever,20.3249,2016-01-05 04:11:44,"Two sneaky puppers were not initially seen, moving the rating to 143/130. Please forgive us. Thank you https://t.co/kRK51Y5ac3","https://twitter.com/dog_rates/status/684225744407494656/photo/1,https://twitter.com/dog_rates/status/684225744407494656/photo/1",No Name,110.00000000000001,pupper,1369,239,1608
684241637099323392,https://pbs.twimg.com/media/CX7qIcdWcAELJ7N.jpg,1,Pembroke,50.8498,2016-01-05 05:14:53,This is Obi. He got camera shy. 12/10 https://t.co/feiPiq7z94,"https://twitter.com/dog_rates/status/684241637099323392/photo/1,https://twitter.com/dog_rates/status/684241637099323392/photo/1,https://twitter.com/dog_rates/status/684241637099323392/photo/1",Obi,120.0,Not Specified,8999,3727,12726
684460069371654144,https://pbs.twimg.com/media/CX-wzZEUwAA4ISM.jpg,1,Labrador Retriever,67.3691,2016-01-05 19:42:51,This is Jeph. He's a Western Sagittarius Dookmarriot. Frightened by leaf. Caught him off guard. 10/10 calm down Jeph https://t.co/bicyOV6lju,https://twitter.com/dog_rates/status/684460069371654144/photo/1,Jeph,100.0,Not Specified,2169,628,2797
684481074559381504,https://pbs.twimg.com/media/CX_D6AJWwAAnBIw.jpg,1,Chihuahua,93.781,2016-01-05 21:06:19,Meet Pippa. She's an Elfin High Feta. Compact af. Easy to transport. Great for vacations. 10/10 would keep in pocket https://t.co/nBtDeZ4yAb,https://twitter.com/dog_rates/status/684481074559381504/photo/1,Pippa,100.0,Not Specified,4249,1320,5569
684538444857667585,https://pbs.twimg.com/ext_tw_video_thumb/684538367950872576/pu/img/kTKOkSU45BS-fpq8.jpg,1,Chihuahua,70.25829999999999,2016-01-06 00:54:18,"After watching this video, we've determined that Pippa will be upgraded to a 12/10. Please enjoy https://t.co/IKoRK4yoxV",https://twitter.com/dog_rates/status/684538444857667585/video/1,No Name,120.0,Not Specified,2915,1085,4000
684594889858887680,https://pbs.twimg.com/media/CYAra7JWsAACPZH.jpg,1,Weimaraner,94.8688,2016-01-06 04:38:35,"""FOR THE LAST TIME I DON'T WANNA PLAY TWISTER ALL THE SPOTS ARE GREY DAMN IT CINDY"" ...10/10 https://t.co/uhQNehTpIu",https://twitter.com/dog_rates/status/684594889858887680/photo/1,No Name,100.0,Not Specified,9843,4016,13859
684800227459624960,https://pbs.twimg.com/media/CYDmK7ZVAAI_ylL.jpg,1,Miniature Schnauzer,29.445700000000002,2016-01-06 18:14:31,Meet Theodore. He's dapper as hell. Probably owns horses. Uses 'summer' as a verb. Often quotes philosophers. 11/10 https://t.co/J3Ld4fRbSy,https://twitter.com/dog_rates/status/684800227459624960/photo/1,Theodore,110.00000000000001,Not Specified,2979,1124,4103
684902183876321280,https://pbs.twimg.com/media/CYFC5lmWAAAEIho.jpg,1,Pembroke,70.80340000000001,2016-01-07 00:59:40,This is Perry. He's an Augustus Gloopster. Very condescending. Makes up for it with the sneaky tongue slip. 11/10 https://t.co/JVvIrUmTkR,https://twitter.com/dog_rates/status/684902183876321280/photo/1,Perry,110.00000000000001,Not Specified,2053,605,2658
684926975086034944,https://pbs.twimg.com/media/CYFZXdiU0AAc_kw.jpg,1,Labrador Retriever,76.9412,2016-01-07 02:38:10,Meet Bruiser &amp; Charlie. They are the best of pals. Been through it all together. Both 11/10. 1 like=1 friendship https://t.co/PEXHuvSVD4,https://twitter.com/dog_rates/status/684926975086034944/photo/1,Bruiser,110.00000000000001,Not Specified,3849,552,4401
