tweet_id,dog_photos_url,photos_count,dog_breed,confidence(%),tweet_timestamp,tweet_content,tweet_url,dog_name,dog_rating,dog_stage,favorite_count,retweet_count,retweet_favorite_sum
666020888022790149,https://pbs.twimg.com/media/CT4udn0WwAA0aMy.jpg,1,Welsh Springer Spaniel,46.5074,2015-11-15 22:32:08,Here we have a Japanese Irish Setter. Lost eye in Vietnam (?). Big fan of relaxing on stair. 8/10 would pet https://t.co/BLDqew2Ijj,https://twitter.com/dog_rates/status/666020888022790149/photo/1,No Name,80.0,Not Specified,2535,532,3067
666029285002620928,https://pbs.twimg.com/media/CT42GRgUYAA5iDo.jpg,1,Redbone,50.6826,2015-11-15 23:05:30,This is a western brown Mitsubishi terrier. Upset about leaf. Actually 2 dogs here. 7/10 would walk the shit out of https://t.co/r7mOb2m0UI,https://twitter.com/dog_rates/status/666029285002620928/photo/1,No Name,70.0,Not Specified,132,48,180
666033412701032449,https://pbs.twimg.com/media/CT4521TWwAEvMyu.jpg,1,German Shepherd,59.646100000000004,2015-11-15 23:21:54,Here is a very happy pup. Big fan of well-maintained decks. Just look at that tongue. 9/10 would cuddle af https://t.co/y671yMhoiR,https://twitter.com/dog_rates/status/666033412701032449/photo/1,No Name,90.0,Not Specified,128,47,175
666050758794694657,https://pbs.twimg.com/media/CT5Jof1WUAEuVxN.jpg,1,Bernese Mountain Dog,65.1137,2015-11-16 00:30:50,This is a truly beautiful English Wilson Staff retriever. Has a nice phone. Privileged. 10/10 would trade lives with https://t.co/fvIbQfHjIe,https://twitter.com/dog_rates/status/666050758794694657/photo/1,No Name,100.0,Not Specified,136,60,196
666055525042405380,https://pbs.twimg.com/media/CT5N9tpXIAAifs1.jpg,1,Chow,69.2517,2015-11-16 00:49:46,Here is a Siberian heavily armored polar bear mix. Strong owner. 10/10 I would do unspeakable things to pet this dog https://t.co/rdivxLiqEt,https://twitter.com/dog_rates/status/666055525042405380/photo/1,No Name,100.0,Not Specified,448,261,709
666058600524156928,https://pbs.twimg.com/media/CT5Qw94XAAA_2dP.jpg,1,Miniature Poodle,20.1493,2015-11-16 01:01:59,Here is the Rand Paul of retrievers folks! He's probably good at poker. Can drink beer (lol rad). 8/10 good dog https://t.co/pYAJkAe76p,https://twitter.com/dog_rates/status/666058600524156928/photo/1,No Name,80.0,Not Specified,115,61,176
666063827256086533,https://pbs.twimg.com/media/CT5Vg_wXIAAXfnj.jpg,1,Golden Retriever,77.593,2015-11-16 01:22:45,This is the happiest dog you will ever see. Very committed owner. Nice couch. 10/10 https://t.co/RhUEAloehK,https://twitter.com/dog_rates/status/666063827256086533/photo/1,No Name,100.0,Not Specified,496,232,728
666071193221509120,https://pbs.twimg.com/media/CT5cN_3WEAAlOoZ.jpg,1,Gordon Setter,50.367200000000004,2015-11-16 01:52:02,Here we have a northern speckled Rhododendron. Much sass. Gives 0 fucks. Good tongue. 9/10 would caress sensually https://t.co/ZoL8kq2XFx,https://twitter.com/dog_rates/status/666071193221509120/photo/1,No Name,90.0,Not Specified,154,67,221
666073100786774016,https://pbs.twimg.com/media/CT5d9DZXAAALcwe.jpg,1,Walker Hound,26.0857,2015-11-16 01:59:36,Let's hope this flight isn't Malaysian (lol). What a dog! Almost completely camouflaged. 10/10 I trust this pilot https://t.co/Yk6GHE9tOY,https://twitter.com/dog_rates/status/666073100786774016/photo/1,No Name,100.0,Not Specified,335,174,509
666094000022159362,https://pbs.twimg.com/media/CT5w9gUW4AAsBNN.jpg,1,Bloodhound,19.5217,2015-11-16 03:22:39,This appears to be a Mongolian Presbyterian mix. Very tired. Tongue slip confirmed. 9/10 would lie down with https://t.co/mnioXo3IfP,https://twitter.com/dog_rates/status/666094000022159362/photo/1,No Name,90.0,Not Specified,169,79,248
666099513787052032,https://pbs.twimg.com/media/CT51-JJUEAA6hV8.jpg,1,Lhasa,58.233000000000004,2015-11-16 03:44:34,Can stand on stump for what seems like a while. Built that birdhouse? Impressive. Made friends with a squirrel. 8/10 https://t.co/Ri4nMTLq5C,https://twitter.com/dog_rates/status/666099513787052032/photo/1,No Name,80.0,Not Specified,164,73,237
666102155909144576,https://pbs.twimg.com/media/CT54YGiWUAEZnoK.jpg,1,English Setter,29.861700000000003,2015-11-16 03:55:04,Oh my. Here you are seeing an Adobe Setter giving birth to twins!!! The world is an amazing place. 11/10 https://t.co/11LvqN4WLq,https://twitter.com/dog_rates/status/666102155909144576/photo/1,No Name,110.00000000000001,Not Specified,81,16,97
666273097616637952,https://pbs.twimg.com/media/CT8T1mtUwAA3aqm.jpg,1,Italian Greyhound,17.6053,2015-11-16 15:14:19,Can take selfies 11/10 https://t.co/ws2AMaNwPW,https://twitter.com/dog_rates/status/666273097616637952/photo/1,No Name,110.00000000000001,Not Specified,184,82,266
666287406224695296,https://pbs.twimg.com/media/CT8g3BpUEAAuFjg.jpg,1,Maltese Dog,85.75309999999999,2015-11-16 16:11:11,This is an Albanian 3 1/2 legged  Episcopalian. Loves well-polished hardwood flooring. Penis on the collar. 9/10 https://t.co/d9NcXFKwLv,https://twitter.com/dog_rates/status/666287406224695296/photo/1,No Name,90.0,Not Specified,152,71,223
666345417576210432,https://pbs.twimg.com/media/CT9Vn7PWoAA_ZCM.jpg,1,Golden Retriever,85.87440000000001,2015-11-16 20:01:42,Look at this jokester thinking seat belt laws don't apply to him. Great tongue tho 10/10 https://t.co/VFKG1vxGjB,https://twitter.com/dog_rates/status/666345417576210432/photo/1,No Name,100.0,Not Specified,307,146,453
666353288456101888,https://pbs.twimg.com/media/CT9cx0tUEAAhNN_.jpg,1,Malamute,33.6874,2015-11-16 20:32:58,Here we have a mixed Asiago from the Galápagos Islands. Only one ear working. Big fan of marijuana carpet. 8/10 https://t.co/tltQ5w9aUO,https://twitter.com/dog_rates/status/666353288456101888/photo/1,No Name,80.0,Not Specified,229,77,306
666373753744588802,https://pbs.twimg.com/media/CT9vZEYWUAAlZ05.jpg,1,Soft-Coated Wheaten Terrier,32.6467,2015-11-16 21:54:18,Those are sunglasses and a jean jacket. 11/10 dog cool af https://t.co/uHXrPkUEyl,https://twitter.com/dog_rates/status/666373753744588802/photo/1,No Name,110.00000000000001,Not Specified,194,100,294
666396247373291520,https://pbs.twimg.com/media/CT-D2ZHWIAA3gK1.jpg,1,Chihuahua,97.8108,2015-11-16 23:23:41,Oh goodness. A super rare northeast Qdoba kangaroo mix. Massive feet. No pouch (disappointing). Seems alert. 9/10 https://t.co/Dc7b0E8qFE,https://twitter.com/dog_rates/status/666396247373291520/photo/1,No Name,90.0,Not Specified,172,92,264
666407126856765440,https://pbs.twimg.com/media/CT-NvwmW4AAugGZ.jpg,1,Black-And-Tan Coonhound,52.913900000000005,2015-11-17 00:06:54,This is a southern Vesuvius bumblegruff. Can drive a truck (wow). Made friends with 5 other nifty dogs (neat). 7/10 https://t.co/LopTBkKa8h,https://twitter.com/dog_rates/status/666407126856765440/photo/1,No Name,70.0,Not Specified,113,44,157
666418789513326592,https://pbs.twimg.com/media/CT-YWb7U8AA7QnN.jpg,1,Toy Terrier,14.968,2015-11-17 00:53:15,This is Walter. He is an Alaskan Terrapin. Loves outdated bandanas. One ear still working. Cool house plant. 10/10 https://t.co/qXpcwENTvn,https://twitter.com/dog_rates/status/666418789513326592/photo/1,Walter,100.0,Not Specified,129,48,177
666421158376562688,https://pbs.twimg.com/media/CT-aggCXAAIMfT3.jpg,1,Blenheim Spaniel,90.6777,2015-11-17 01:02:40,*internally screaming* 12/10 https://t.co/YMcrXC2Y6R,https://twitter.com/dog_rates/status/666421158376562688/photo/1,No Name,120.0,Not Specified,327,118,445
666428276349472768,https://pbs.twimg.com/media/CT-g-0DUwAEQdSn.jpg,1,Pembroke,37.1361,2015-11-17 01:30:57,Here we have an Austrian Pulitzer. Collectors edition. Levitates (?). 7/10 would garden with https://t.co/NMQq6HIglK,https://twitter.com/dog_rates/status/666428276349472768/photo/1,No Name,70.0,Not Specified,171,90,261
666435652385423360,https://pbs.twimg.com/media/CT-nsTQWEAEkyDn.jpg,1,Chesapeake Bay Retriever,18.413,2015-11-17 02:00:15,"""Can you behave? You're ruining my wedding day""
DOG: idgaf this flashlight tastes good as hell

10/10 https://t.co/GlFZPzqcEU",https://twitter.com/dog_rates/status/666435652385423360/photo/1,No Name,100.0,Not Specified,170,54,224
666437273139982337,https://pbs.twimg.com/media/CT-pKmRWIAAxUWj.jpg,1,Chihuahua,67.1853,2015-11-17 02:06:42,Here we see a lone northeastern Cumberbatch. Half ladybug. Only builds with bricks. Very confident with body. 7/10 https://t.co/7LtjBS0GPK,https://twitter.com/dog_rates/status/666437273139982337/photo/1,No Name,70.0,Not Specified,131,52,183
666447344410484738,https://pbs.twimg.com/media/CT-yU5QWwAEjLX5.jpg,1,Curly-Coated Retriever,32.208400000000005,2015-11-17 02:46:43,This is Scout. She is a black Downton Abbey. Isn't afraid to get dirty. 9/10 nothing bad to say https://t.co/kH60oka1HW,https://twitter.com/dog_rates/status/666447344410484738/photo/1,Scout,90.0,Not Specified,107,23,130
666454714377183233,https://pbs.twimg.com/media/CT-5Bs-WUAA2JeC.jpg,1,Dalmatian,27.8954,2015-11-17 03:16:00,I'll name the dogs from now on. This is Kreggory. He does parkour. 10/10 https://t.co/uPqPeXAcua,https://twitter.com/dog_rates/status/666454714377183233/photo/1,Kreggory,100.0,Not Specified,545,223,768
666644823164719104,https://pbs.twimg.com/media/CUBl6IwVAAA9_zT.jpg,1,Ibizan Hound,4.43334,2015-11-17 15:51:26,This is Jimothy. He is a Botwanian Gouda. Can write (impressive). Very erect tail. Still looking for hoco date. 9/10 https://t.co/LEkZjZxESQ,https://twitter.com/dog_rates/status/666644823164719104/photo/1,Jimothy,90.0,Not Specified,238,88,326
666691418707132416,https://pbs.twimg.com/media/CUCQTpEWEAA7EDz.jpg,1,German Shepherd,97.5401,2015-11-17 18:56:35,This is Christoper. He is a spotted Penne. Can easily navigate stairs. 8/10 https://t.co/bg4TqvvkuF,https://twitter.com/dog_rates/status/666691418707132416/photo/1,Christoper,80.0,Not Specified,196,51,247
666701168228331520,https://pbs.twimg.com/media/CUCZLHlUAAAeAig.jpg,1,Labrador Retriever,88.7707,2015-11-17 19:35:19,This is a golden Buckminsterfullerene named Johm. Drives trucks. Lumberjack (?). Enjoys wall. 8/10 would hug softly https://t.co/uQbZJM2DQB,https://twitter.com/dog_rates/status/666701168228331520/photo/1,No Name,80.0,Not Specified,449,234,683
666739327293083650,https://pbs.twimg.com/media/CUC74aTWoAInZey.jpg,1,Miniature Poodle,54.6933,2015-11-17 22:06:57,This is Lugan. He is a Bohemian Rhapsody. Very confused dog. Thinks his name is Rocky. Not amused by the snows 10/10 https://t.co/tI3uFLDHBI,https://twitter.com/dog_rates/status/666739327293083650/photo/1,Lugan,100.0,Not Specified,244,71,315
666781792255496192,https://pbs.twimg.com/media/CUDigRXXIAATI_H.jpg,1,Italian Greyhound,61.831599999999995,2015-11-18 00:55:42,This is a purebred Bacardi named Octaviath. Can shoot spaghetti out of mouth. 10/10 https://t.co/uEvsGLOFHa,https://twitter.com/dog_rates/status/666781792255496192/photo/1,No Name,100.0,Not Specified,404,211,615
666804364988780544,https://pbs.twimg.com/media/CUD3A7YWoAA82N0.jpg,1,English Setter,32.879200000000004,2015-11-18 02:25:23,This is Jockson. He is a Pinnacle Sagittarius. Fancy bandana. Enjoys lightly sucking on hot dog in nature. 8/10 https://t.co/RdKbAOEpDK,https://twitter.com/dog_rates/status/666804364988780544/photo/1,Jockson,80.0,Not Specified,250,95,345
666817836334096384,https://pbs.twimg.com/media/CUEDSMEWEAAuXVZ.jpg,1,Miniature Schnauzer,49.695299999999996,2015-11-18 03:18:55,This is Jeph. He is a German Boston Shuttlecock. Enjoys couch. Lost body during French Revolution. True hero 9/10 https://t.co/8whlkYw3mO,https://twitter.com/dog_rates/status/666817836334096384/photo/1,Jeph,90.0,Not Specified,540,267,807
666826780179869698,https://pbs.twimg.com/media/CUELa0NUkAAscGC.jpg,1,Maltese Dog,35.9383,2015-11-18 03:54:28,12/10 simply brilliant pup https://t.co/V6ZzG45zzG,https://twitter.com/dog_rates/status/666826780179869698/photo/1,No Name,120.0,Not Specified,266,105,371
666835007768551424,https://pbs.twimg.com/media/CUES51dXIAEahyG.jpg,1,Airedale,44.8459,2015-11-18 04:27:09,These are Peruvian Feldspars. Their names are Cupit and Prencer. Both resemble Rand Paul. Sick outfits 10/10 &amp; 10/10 https://t.co/ZnEMHBsAs1,https://twitter.com/dog_rates/status/666835007768551424/photo/1,No Name,100.0,Not Specified,222,83,305
667044094246576128,https://pbs.twimg.com/media/CUHREBXXAAE6A9b.jpg,1,Golden Retriever,76.5266,2015-11-18 18:17:59,12/10 gimme now https://t.co/QZAnwgnOMB,https://twitter.com/dog_rates/status/667044094246576128/photo/1,No Name,120.0,Not Specified,198,54,252
667062181243039745,https://pbs.twimg.com/media/CUHhgvHUAAA4aB0.jpg,1,Chesapeake Bay Retriever,82.5678,2015-11-18 19:29:52,This is Keet. He is a Floridian Amukamara. Absolutely epic propeller hat. Pristine tongue. Nice plaid. 10/10 https://t.co/tz1lpuvXLA,https://twitter.com/dog_rates/status/667062181243039745/photo/1,Keet,100.0,Not Specified,227,57,284
667073648344346624,https://pbs.twimg.com/media/CUHr8WbWEAEBPgf.jpg,1,Chihuahua,48.3682,2015-11-18 20:15:26,Here is Dave. He is actually just a skinny legged seal. Happy birthday Dave. 10/10 https://t.co/DPSamreuRq,https://twitter.com/dog_rates/status/667073648344346624/photo/1,Dave,100.0,Not Specified,425,134,559
667090893657276420,https://pbs.twimg.com/media/CUH7oLuUsAELWib.jpg,1,Chihuahua,95.95139999999999,2015-11-18 21:23:57,This is Clybe. He is an Anemone Valdez. One ear works. Can look in 2 different directions at once. Tongue slip. 7/10 https://t.co/Ks0jZtdIrr,https://twitter.com/dog_rates/status/667090893657276420/photo/1,Clybe,70.0,Not Specified,349,132,481
667119796878725120,https://pbs.twimg.com/media/CUIV6F7XIAA1tAM.jpg,1,Pembroke,74.1563,2015-11-18 23:18:48,This is Gabe. He is a southern Baklava. Gabe has always wanted to fit in with the other bananas. 10/10 fabulous https://t.co/3LZrJzg3BJ,https://twitter.com/dog_rates/status/667119796878725120/photo/1,Gabe,100.0,Not Specified,346,135,481
667138269671505920,https://pbs.twimg.com/media/CUImtzEVAAAZNJo.jpg,1,West Highland White Terrier,74.7713,2016-06-17 16:01:16,RT @dog_rates: Extremely intelligent dog here. Has learned to walk like human. Even has his own dog. Very impressive 10/10 https://t.co/0Dv…,https://twitter.com/dog_rates/status/667138269671505920/photo/1,No Name,100.0,Not Specified,4851,2387,7238
667152164079423490,https://pbs.twimg.com/media/CUIzWk_UwAAfUNq.jpg,1,Toy Poodle,53.5411,2017-03-12 00:59:17,RT @dog_rates: This is Pipsy. He is a fluffball. Enjoys traveling the sea &amp; getting tangled in leash. 12/10 I would kill for Pipsy https://…,https://twitter.com/dog_rates/status/667152164079423490/photo/1,Pipsy,120.0,Not Specified,49720,18285,68005
667160273090932737,https://pbs.twimg.com/media/CUI6uuaW4AAvCIs.jpg,1,Golden Retriever,47.1351,2015-11-19 01:59:39,This is Bradlay. He is a Ronaldinho Matsuyama mix. Can also mountain bike (wow). Loves that blue light lime. 11/10 https://t.co/DKhgkMx4N1,https://twitter.com/dog_rates/status/667160273090932737/photo/1,Bradlay,110.00000000000001,Not Specified,268,66,334
667165590075940865,https://pbs.twimg.com/media/CUI_kHBWsAAAef5.jpg,1,Miniature Pinscher,14.017299999999999,2015-11-19 02:20:46,This is Churlie. AKA Fetty Woof. Lost eye saving a school bus full of toddlers from a tsunami. Great guy. 10/10 https://t.co/li2XYBVuAY,https://twitter.com/dog_rates/status/667165590075940865/photo/1,Churlie,100.0,Not Specified,2819,1241,4060
667171260800061440,https://pbs.twimg.com/media/CUJEuRIXIAAPDLt.jpg,1,Giant Schnauzer,84.1265,2015-11-19 02:43:18,Say hello to Kenneth. He likes Reese's Puffs. 10/10 https://t.co/6RHNRsByOY,https://twitter.com/dog_rates/status/667171260800061440/photo/1,Kenneth,100.0,Not Specified,235,97,332
667174963120574464,https://pbs.twimg.com/media/CUJIFoJWsAAL3Dc.jpg,1,Toy Poodle,26.6437,2015-11-19 02:58:01,"This is Clarence. His face says he doesn't want to be a donkey, but his tail is super pumped about it. 9/10 https://t.co/fGDWgukcBs",https://twitter.com/dog_rates/status/667174963120574464/photo/1,Clarence,90.0,Not Specified,262,88,350
667177989038297088,https://pbs.twimg.com/media/CUJK18UWEAEg7AR.jpg,1,Vizsla,25.924899999999994,2015-11-19 03:10:02,This is a Dasani Kingfisher from Maine. His name is Daryl. Daryl doesn't like being swallowed by a panda. 8/10 https://t.co/jpaeu6LNmW,https://twitter.com/dog_rates/status/667177989038297088/photo/1,No Name,80.0,Not Specified,200,58,258
667182792070062081,https://pbs.twimg.com/media/CUJPNjOWsAAZRqP.jpg,1,Golden Retriever,94.9892,2016-11-15 17:54:59,RT @dog_rates: This is Timison. He just told an awful joke but is still hanging on to the hope that you'll laugh with him. 10/10 https://t.…,https://twitter.com/dog_rates/status/667182792070062081/photo/1,Timison,100.0,Not Specified,15075,6618,21693
667192066997374976,https://pbs.twimg.com/media/CUJXpRBXIAAN0yz.jpg,1,Rottweiler,28.364,2015-11-19 04:05:59,*takes several long deep breaths* omg omg oMG OMG OMG OMGSJYBSNDUYWJO 12/10 https://t.co/QCugm5ydl6,https://twitter.com/dog_rates/status/667192066997374976/photo/1,No Name,120.0,Not Specified,414,115,529
667200525029539841,https://pbs.twimg.com/media/CUJfVMPXIAAgbue.jpg,1,Siberian Husky,69.4904,2015-11-19 04:39:35,This is Joshwa. He is a fuckboy supreme. He clearly relies on owner but doesn't respect them. Dreamy eyes tho 11/10 https://t.co/60xYFRATPZ,https://twitter.com/dog_rates/status/667200525029539841/photo/1,Joshwa,110.00000000000001,Not Specified,658,282,940
667211855547486208,https://pbs.twimg.com/media/CUJppKJWoAA75NP.jpg,1,Golden Retriever,46.2556,2015-11-19 05:24:37,This is Genevieve. She is a golden retriever cocktail mix. Comfortable close to wall. Shows no emotions. 9/10 https://t.co/azEoGqVonH,https://twitter.com/dog_rates/status/667211855547486208/photo/1,Genevieve,90.0,Not Specified,516,258,774
667393430834667520,https://pbs.twimg.com/media/CUMOyd3XIAAl13H.jpg,1,Papillon,55.7009,2015-11-19 17:26:08,This is Fwed. He is a Canadian Asian Taylormade. Was having a blast until pink spiky football attacked. 8/10 https://t.co/A37eGLz5WS,https://twitter.com/dog_rates/status/667393430834667520/photo/1,Fwed,80.0,Not Specified,211,60,271
667405339315146752,https://pbs.twimg.com/media/CUMZnmhUEAEbtis.jpg,1,Saint Bernard,38.1377,2015-11-19 18:13:27,This is Biden. Biden just tripped... 7/10 https://t.co/3Fm9PwLju1,https://twitter.com/dog_rates/status/667405339315146752/photo/1,Biden,70.0,Not Specified,489,234,723
667435689202614272,https://pbs.twimg.com/media/CUM1OHCW4AEgGSi.jpg,1,Rottweiler,99.9091,2015-11-19 20:14:03,Ermergerd 12/10 https://t.co/PQni2sjPsm,https://twitter.com/dog_rates/status/667435689202614272/photo/1,No Name,120.0,Not Specified,326,89,415
667453023279554560,https://pbs.twimg.com/media/CUNE_OSUwAAdHhX.jpg,1,Labrador Retriever,82.56700000000001,2015-11-19 21:22:56,Meet Cupcake. I would do unspeakable things for Cupcake. 11/10 https://t.co/6uLCWR9Efa,https://twitter.com/dog_rates/status/667453023279554560/photo/1,Cupcake,110.00000000000001,Not Specified,327,96,423
667455448082227200,https://pbs.twimg.com/media/CUNHMXTU8AAS3HH.jpg,1,Tibetan Terrier,67.63759999999999,2015-11-19 21:32:34,This is Reese and Twips. Reese protects Twips. Both think they're too good for seat belts. Simply reckless. 7/10s https://t.co/uLzRi1drVK,https://twitter.com/dog_rates/status/667455448082227200/photo/1,Reese,70.0,Not Specified,203,66,269
667470559035432960,https://pbs.twimg.com/media/CUNU78YWEAECmpB.jpg,1,Toy Poodle,30.417499999999997,2015-11-19 22:32:36,This is a northern Wahoo named Kohl. He runs this town. Chases tumbleweeds. Draws gun wicked fast. 11/10 legendary https://t.co/J4vn2rOYFk,https://twitter.com/dog_rates/status/667470559035432960/photo/1,No Name,110.00000000000001,Not Specified,273,102,375
667491009379606528,https://pbs.twimg.com/media/CUNniSlUYAEj1Jl.jpg,1,Borzoi,85.2088,2015-11-19 23:53:52,Two dogs in this one. Both are rare Jujitsu Pythagoreans. One slightly whiter than other. Long legs. 7/10 and 8/10 https://t.co/ITxxcc4v9y,https://twitter.com/dog_rates/status/667491009379606528/photo/1,No Name,70.0,Not Specified,559,242,801
667495797102141441,https://pbs.twimg.com/media/CUNr4-7UwAAg2lq.jpg,1,Chihuahua,14.3957,2015-11-20 00:12:54,This is Philippe from Soviet Russia. Commanding leader. Misplaced other boot. Hung flag himself. 9/10 charismatic af https://t.co/5NhPV8E45i,https://twitter.com/dog_rates/status/667495797102141441/photo/1,Philippe,90.0,Not Specified,565,294,859
667502640335572993,https://pbs.twimg.com/media/CUNyHTMUYAAQVch.jpg,1,Labrador Retriever,99.67089999999999,2015-11-20 00:40:05,Say hello to Hall and Oates. Oates is winking and Hall is contemplating the artistic entropy of the universe. 11/10s https://t.co/n5Wtb5Hvsl,https://twitter.com/dog_rates/status/667502640335572993/photo/1,Hall,110.00000000000001,Not Specified,563,231,794
667509364010450944,https://pbs.twimg.com/media/CUN4Or5UAAAa5K4.jpg,1,Beagle,63.6169,2016-11-15 20:47:30,RT @dog_rates: This a Norwegian Pewterschmidt named Tickles. Ears for days. 12/10 I care deeply for Tickles https://t.co/0aDF62KVP7,"https://twitter.com/dog_rates/status/667509364010450944/photo/1,https://twitter.com/dog_rates/status/667509364010450944/photo/1",No Name,120.0,Not Specified,7148,2272,9420
667517642048163840,https://pbs.twimg.com/media/CUN_wiBUkAAakT0.jpg,1,Italian Greyhound,12.517600000000002,2015-11-20 01:39:42,This is Dook &amp; Milo. Dook is struggling to find who he really is and Milo is terrified of what that might be. 8/10s https://t.co/fh5KflzBR0,https://twitter.com/dog_rates/status/667517642048163840/photo/1,Dook,80.0,Not Specified,389,203,592
667530908589760512,https://pbs.twimg.com/media/CUOL0uGUkAAx7yh.jpg,1,Golden Retriever,63.3037,2015-11-20 02:32:25,"Meet Naphaniel. He doesn't necessarily enjoy his day job, but he's damn good at it. 10/10 https://t.co/xoRWyQTcmy",https://twitter.com/dog_rates/status/667530908589760512/photo/1,Naphaniel,100.0,Not Specified,501,264,765
667534815156183040,https://pbs.twimg.com/media/CUOPYI5UcAAj_nO.jpg,1,Pembroke,43.5254,2015-11-20 02:47:56,"This is Frank (pronounced ""Fronq""). Too many boxing gloves, not enough passion. Frank is a lover not a fighter. 8/10 https://t.co/CpPxD28IpV",https://twitter.com/dog_rates/status/667534815156183040/photo/1,Frank,80.0,Not Specified,866,576,1442
667538891197542400,https://pbs.twimg.com/media/CUOTFZOW4AABsfW.jpg,1,Yorkshire Terrier,61.8957,2015-11-20 03:04:08,"This is a southwest Coriander named Klint. Hat looks expensive. Still on house arrest :(
9/10 https://t.co/IQTOMqDUIe",https://twitter.com/dog_rates/status/667538891197542400/photo/1,No Name,90.0,Not Specified,220,72,292
667544320556335104,https://pbs.twimg.com/media/CUOYBbbWIAAXQGU.jpg,1,Pomeranian,41.289300000000004,2015-11-20 03:25:43,"This is Kial. Kial is either wearing a cape, which would be rad, or flashing us, which would be rude. 10/10 or 4/10 https://t.co/8zcwIoiuqR",https://twitter.com/dog_rates/status/667544320556335104/photo/1,Kial,100.0,Not Specified,917,568,1485
667546741521195010,https://pbs.twimg.com/media/CUOaOWXWcAA0_Jy.jpg,1,Toy Poodle,78.7424,2015-11-20 03:35:20,Here is George. George took a selfie of his new man bun and that is downright epic. (Also looks like Rand Paul) 9/10 https://t.co/afRtVsoIIb,https://twitter.com/dog_rates/status/667546741521195010/photo/1,George,90.0,Not Specified,355,138,493
667728196545200128,https://pbs.twimg.com/media/CUQ_QahUAAAVQjn.jpg,1,Kuvasz,36.0159,2015-11-20 15:36:22,Meet Olive. He comes to spot by tree to reminisce of simpler times and truly admire his place in the universe. 11/10 https://t.co/LwrCwlWwPB,https://twitter.com/dog_rates/status/667728196545200128/photo/1,Olive,110.00000000000001,Not Specified,398,162,560
667773195014021121,https://pbs.twimg.com/media/CURoLrOVEAAaWdR.jpg,1,West Highland White Terrier,36.046499999999995,2015-11-20 18:35:10,This is a rare Hungarian Pinot named Jessiga. She is either mid-stroke or got stuck in the washing machine. 8/10 https://t.co/ZU0i0KJyqD,https://twitter.com/dog_rates/status/667773195014021121/photo/1,No Name,80.0,Not Specified,243,61,304
667793409583771648,https://pbs.twimg.com/media/CUR6jqVWsAEgGot.jpg,1,Dalmatian,53.507299999999994,2015-11-20 19:55:30,Dogs only please. Small cows and other non canines will not be tolerated. Sick tattoos tho 8/10 https://t.co/s1z7mX4c9O,https://twitter.com/dog_rates/status/667793409583771648/photo/1,No Name,80.0,Not Specified,736,358,1094
667801013445750784,https://pbs.twimg.com/media/CUSBemVUEAAn-6V.jpg,1,Flat-Coated Retriever,50.8392,2015-11-20 20:25:43,OMIGOD 12/10 https://t.co/SVMF4Frf1w,https://twitter.com/dog_rates/status/667801013445750784/photo/1,No Name,120.0,Not Specified,346,101,447
667832474953625600,https://pbs.twimg.com/media/CUSeGFNW4AAyyHC.jpg,1,Miniature Pinscher,21.42,2015-11-20 22:30:44,"THE EYES 12/10

I'm sorry. These are supposed to be funny but your dogs are too adorable https://t.co/z1xPTgVLc7",https://twitter.com/dog_rates/status/667832474953625600/photo/1,No Name,120.0,Not Specified,303,68,371
667861340749471744,https://pbs.twimg.com/media/CUS4WJ-UsAEJj10.jpg,1,Malamute,96.7275,2015-11-21 00:25:26,This is a Shotokon Macadamia mix named Cheryl. Sophisticated af. Looks like a disappointed librarian. Shh (lol) 9/10 https://t.co/J4GnJ5Swba,https://twitter.com/dog_rates/status/667861340749471744/photo/1,No Name,90.0,Not Specified,253,86,339
667885044254572545,https://pbs.twimg.com/media/CUTN5V4XAAAIa4R.jpg,1,Malamute,8.852970000000001,2015-11-21 01:59:37,Meet Stu. Stu has stacks on stacks and an eye made of pure gold. 10/10 pay for my tuition pls https://t.co/7rkYZQdKEd,https://twitter.com/dog_rates/status/667885044254572545/photo/1,Stu,100.0,Not Specified,868,530,1398
667886921285246976,https://pbs.twimg.com/media/CUTPnPCW4AI7R0y.jpg,1,Pomeranian,80.0432,2015-11-21 02:07:05,This is Erik. He's fucken massive. But also kind. Let's people hug him for free. Looks soft. 11/10 I would hug Erik https://t.co/MT7Q4aDQS1,https://twitter.com/dog_rates/status/667886921285246976/photo/1,Erik,110.00000000000001,Not Specified,2011,1180,3191
