tweet_id,dog_photos_url,photos_count,dog_breed,confidence(%),tweet_timestamp,tweet_content,tweet_url,dog_name,dog_rating,dog_stage,favorite_count,retweet_count,retweet_favorite_sum
719991154352222208,https://pbs.twimg.com/media/Cf3sH62VAAA-LiP.jpg,2,Golden Retriever,60.53039999999999,2016-04-12 20:50:42,This doggo was initially thrilled when she saw the happy cartoon pup but quickly realized she'd been deceived. 10/10 https://t.co/mvnBGaWULV,"https://twitter.com/dog_rates/status/719991154352222208/photo/1,https://twitter.com/dog_rates/status/719991154352222208/photo/1",No Name,100.0,doggo,5281,1979,7260
720043174954147842,https://pbs.twimg.com/media/Cf4bcm8XEAAX4xV.jpg,1,Samoyed,95.45169999999999,2016-04-13 00:17:25,This is Neptune. He's a Snowy Swiss Mountain Floofapolis. Cheeky wink. Tongue nifty af. 11/10 would pet so firmly https://t.co/SoZq2Xoopv,https://twitter.com/dog_rates/status/720043174954147842/photo/1,Neptune,110.00000000000001,Not Specified,5332,2253,7585
720059472081784833,https://pbs.twimg.com/media/Cf4qRcmWEAA9V4h.jpg,1,Mexican Hairless,45.185199999999995,2016-04-13 01:22:10,This is Charleson. He lost his plunger. Looked everywhere. Can't find it. So sad. 9/10 would comfort https://t.co/pRHX8yn9Yu,https://twitter.com/dog_rates/status/720059472081784833/photo/1,Charleson,90.0,Not Specified,4229,1268,5497
720389942216527872,https://pbs.twimg.com/media/Cf9W1J-UMAErahM.jpg,1,Pembroke,87.3977,2016-04-13 23:15:21,This is Ralphé. He patrols the lake. Looking for babes. 11/10 https://t.co/Pb6iMmo0wk,https://twitter.com/dog_rates/status/720389942216527872/photo/1,Ralphé,110.00000000000001,Not Specified,6974,2840,9814
720415127506415616,https://pbs.twimg.com/media/Cf9tuHUWsAAHSrV.jpg,1,Rottweiler,99.0312,2016-04-14 00:55:25,Garden's coming in nice this year. 10/10 https://t.co/5Lra3e4rrw,"https://twitter.com/dog_rates/status/720415127506415616/photo/1,https://twitter.com/dog_rates/status/720415127506415616/photo/1,https://twitter.com/dog_rates/status/720415127506415616/photo/1",No Name,100.0,Not Specified,4503,1681,6184
720775346191278080,https://pbs.twimg.com/media/CgC1WqMW4AI1_N0.jpg,1,Newfoundland,48.997,2016-04-15 00:46:48,This is Berkeley. He's in a predicament. 10/10 someone help him https://t.co/XSEXdQupej,https://twitter.com/dog_rates/status/720775346191278080/photo/1,Berkeley,100.0,Not Specified,2702,760,3462
720785406564900865,https://pbs.twimg.com/media/CgC-gMCWcAAawUE.jpg,1,Chihuahua,89.64219999999999,2016-04-15 01:26:47,This is Archie. He hears everything you say. Doesn't matter where you are. 12/10 https://t.co/0l4I8famYp,https://twitter.com/dog_rates/status/720785406564900865/photo/1,Archie,120.0,Not Specified,3400,866,4266
721001180231503872,https://pbs.twimg.com/media/CgGCvxAUkAAx55r.jpg,1,Samoyed,95.0053,2016-04-15 15:44:11,This is Oliver. Bath time is upon him. His fear of the wetness postpones his ultimate pupper destiny. 11/10 https://t.co/AFzzKqR4tT,https://twitter.com/dog_rates/status/721001180231503872/photo/1,Oliver,110.00000000000001,pupper,2748,686,3434
721503162398597120,https://pbs.twimg.com/media/CgNLS1PW8AAxWSN.jpg,3,Pomeranian,99.775,2016-04-17 00:58:53,This is Panda. He's happy af. 11/10 https://t.co/IOAk9i4UvE,"https://twitter.com/dog_rates/status/721503162398597120/photo/1,https://twitter.com/dog_rates/status/721503162398597120/photo/1,https://twitter.com/dog_rates/status/721503162398597120/photo/1,https://twitter.com/dog_rates/status/721503162398597120/photo/1",Panda,110.00000000000001,Not Specified,5086,2124,7210
722613351520608256,https://pbs.twimg.com/media/Cgc9AjMVIAERdUA.jpg,1,Labrador Retriever,53.09149999999999,2016-04-20 02:30:23,Meet Schnitzel. He's a Tropicana Floofboop. Getting too big for his favorite basket. 12/10 just so damn fluffy https://t.co/qjd0UJKYUY,https://twitter.com/dog_rates/status/722613351520608256/photo/1,Schnitzel,120.0,Not Specified,5393,1831,7224
722974582966214656,https://pbs.twimg.com/media/CgiFjIpWgAA4wVp.jpg,1,Great Dane,24.6762,2016-04-21 02:25:47,Happy 4/20 from the squad! 13/10 for all https://t.co/eV1diwds8a,https://twitter.com/dog_rates/status/722974582966214656/photo/1,No Name,130.0,Not Specified,4493,1764,6257
723673163800948736,https://pbs.twimg.com/media/CgsA5eFWgAAu0qn.jpg,1,Golden Retriever,83.939,2016-04-23 00:41:42,This is Ivar. She is a badass Viking warrior. Will sack your village. 10/10 savage af https://t.co/Dz6MiVssVU,https://twitter.com/dog_rates/status/723673163800948736/photo/1,Ivar,100.0,Not Specified,3291,1011,4302
723912936180330496,https://pbs.twimg.com/media/Cgva-QqUUAA7Hv9.jpg,1,Samoyed,99.1772,2016-04-23 16:34:28,This is Sugar. She's a Bolivian Superfloof. Spherical af. 12/10 would never let go of https://t.co/AhMfUu6Onm,https://twitter.com/dog_rates/status/723912936180330496/photo/1,Sugar,120.0,Not Specified,4236,1374,5610
724046343203856385,https://pbs.twimg.com/media/CgxUTS_XEAAC0pv.jpg,1,Boxer,82.62719999999999,2016-04-24 01:24:35,"This is Sarge. Not even he knows what his tongue is doing, but it's pretty damn spectacular. 10/10 https://t.co/pIQEdbBxdL",https://twitter.com/dog_rates/status/724046343203856385/photo/1,Sarge,100.0,Not Specified,2901,620,3521
724049859469295616,https://pbs.twimg.com/media/CgxXf1TWYAEjY61.jpg,1,Border Collie,58.1835,2016-04-24 01:38:33,This is Kreggory. He just took a look at his student debt. 10/10 can't even comprehend it https://t.co/XTsZTgilnT,https://twitter.com/dog_rates/status/724049859469295616/photo/1,Kreggory,100.0,Not Specified,4738,1984,6722
724405726123311104,https://pbs.twimg.com/media/Cg2bKLAWwAA0WEm.jpg,1,Golden Retriever,24.069499999999998,2016-04-25 01:12:38,This is Ashleigh. She's having Coachella withdrawals. Didn't even go tho. 10/10 stay strong pupper https://t.co/nRUaKWnJfH,https://twitter.com/dog_rates/status/724405726123311104/photo/1,Ashleigh,100.0,pupper,5800,1847,7647
724771698126512129,https://pbs.twimg.com/media/Cg7n_-OU8AA5RR1.jpg,2,German Short-Haired Pointer,83.5491,2016-04-26 01:26:53,Nothin better than a doggo and a sunset. 11/10 https://t.co/JlFqOhrHEs,"https://twitter.com/dog_rates/status/724771698126512129/photo/1,https://twitter.com/dog_rates/status/724771698126512129/photo/1,https://twitter.com/dog_rates/status/724771698126512129/photo/1,https://twitter.com/dog_rates/status/724771698126512129/photo/1",No Name,110.00000000000001,doggo,2593,725,3318
724983749226668032,https://pbs.twimg.com/media/Cg-o3w0WgAANXdv.jpg,1,Golden Retriever,67.575,2016-04-26 15:29:30,This is Fred-Rick. He dabbles in parkour. The elevation gives him power. 12/10 hopefully visiting a mailbox near you https://t.co/qFqLtudIiD,https://twitter.com/dog_rates/status/724983749226668032/photo/1,Fred,120.0,Not Specified,4040,1462,5502
725729321944506368,https://pbs.twimg.com/media/ChJO9YaWYAEL0zC.jpg,1,Boxer,59.9076,2016-04-28 16:52:08,This is Lola. She's a Butternut Splishnsplash. They are known to be ferocious af. 12/10 would absolutely still pet https://t.co/adQt5a6TZU,https://twitter.com/dog_rates/status/725729321944506368/photo/1,Lola,120.0,Not Specified,5646,2009,7655
725786712245440512,https://pbs.twimg.com/media/ChKDKmIWIAIJP_e.jpg,1,Chow,33.576100000000004,2016-04-28 20:40:11,Say hello to Lillie. She's a Rutabagan Floofem. Poor pupper ate and then passed out. 11/10 relatable af https://t.co/uIdGqug9rw,https://twitter.com/dog_rates/status/725786712245440512/photo/1,Lillie,110.00000000000001,pupper,4537,1527,6064
725842289046749185,https://pbs.twimg.com/media/ChK1tdBWwAQ1flD.jpg,1,Toy Poodle,42.046299999999995,2016-08-18 01:03:45,RT @dog_rates: This is Colby. He's currently regretting all those times he shook your hand for an extra treat. 12/10 https://t.co/vtVHtKFtBH,"https://twitter.com/dog_rates/status/725842289046749185/photo/1,https://twitter.com/dog_rates/status/725842289046749185/photo/1",Colby,120.0,Not Specified,7691,2970,10661
726828223124897792,https://pbs.twimg.com/media/ChY2aHyWMAAbNQE.jpg,1,Miniature Pinscher,25.532700000000002,2016-05-01 17:38:46,This is Bloop. He's a Phoenician Winnebago. Tongue is just wow. That box is all he has (tragic). 12/10 would caress https://t.co/DWNrPPXgHA,https://twitter.com/dog_rates/status/726828223124897792/photo/1,Bloop,120.0,Not Specified,3882,1124,5006
726887082820554753,https://pbs.twimg.com/media/ChZr8SdWIAAVQKt.jpg,1,Soft-Coated Wheaten Terrier,51.59189999999999,2016-05-01 21:32:40,This is Blitz. He's a new dad struggling to cope mentally with the pressures of being a father. Sick shades 10/10 https://t.co/2AVcJ2BZsy,https://twitter.com/dog_rates/status/726887082820554753/photo/1,Blitz,100.0,Not Specified,4195,1677,5872
727175381690781696,https://pbs.twimg.com/media/ChdyJvdWwAA5HGd.jpg,2,Flat-Coated Retriever,65.6463,2016-05-02 16:38:15,This is Karll. He just wants to go kayaking. 10/10 please someone take Karll kayaking already https://t.co/vXLkvyNQHp,"https://twitter.com/dog_rates/status/727175381690781696/photo/1,https://twitter.com/dog_rates/status/727175381690781696/photo/1",Karll,100.0,Not Specified,4209,1540,5749
727314416056803329,https://pbs.twimg.com/media/Chfwmd9U4AQTf1b.jpg,2,Toy Poodle,82.7469,2016-05-03 01:50:44,This pupper was about to explain where that dirt came from but then decided against it. 11/10 https://t.co/SbaelU6zRs,"https://twitter.com/dog_rates/status/727314416056803329/photo/1,https://twitter.com/dog_rates/status/727314416056803329/photo/1,https://twitter.com/dog_rates/status/727314416056803329/photo/1",No Name,110.00000000000001,pupper,3623,834,4457
727524757080539137,https://pbs.twimg.com/media/Chiv6BAW4AAiQvH.jpg,2,Pomeranian,95.8834,2016-05-03 15:46:33,This pupper had to undergo emergency haircut surgery so he could hear again. 10/10 miraculous af https://t.co/fUyDIFkBwx,"https://twitter.com/dog_rates/status/727524757080539137/photo/1,https://twitter.com/dog_rates/status/727524757080539137/photo/1",No Name,100.0,pupper,4900,1379,6279
727644517743104000,https://pbs.twimg.com/media/Chkc1BQUoAAa96R.jpg,2,Great Pyrenees,45.7164,2016-05-03 23:42:26,Here's a doggo struggling to cope with the winds. 13/10 https://t.co/qv3aUwaouT,"https://twitter.com/dog_rates/status/727644517743104000/photo/1,https://twitter.com/dog_rates/status/727644517743104000/photo/1",No Name,130.0,doggo,6431,1962,8393
727685679342333952,https://pbs.twimg.com/media/ChlCQg-VIAQ_8g4.jpg,1,Border Collie,46.2408,2016-05-04 02:26:00,This is Cilantro. She's a Fellation Gadzooks. Eyes are super magical af. 12/10 could get lost in https://t.co/yJ26LNuyj5,https://twitter.com/dog_rates/status/727685679342333952/photo/1,Cilantro,120.0,Not Specified,3206,720,3926
728015554473250816,https://pbs.twimg.com/media/ChpuRyvVAAARMoq.jpg,1,Cocker Spaniel,38.4559,2016-05-05 00:16:48,This is Rueben. He has reached ultimate pupper zen state. 11/10 tranquil af https://t.co/Z167HgtnBi,https://twitter.com/dog_rates/status/728015554473250816/photo/1,Rueben,110.00000000000001,pupper,4479,1219,5698
728046963732717569,https://pbs.twimg.com/media/ChqK2cVWMAAE5Zj.jpg,1,Newfoundland,25.5971,2016-05-05 02:21:37,This is Raymond. He controls fountains with his tongue. 11/10 pretty damn magical https://t.co/9aMxSbOaAZ,https://twitter.com/dog_rates/status/728046963732717569/photo/1,Raymond,110.00000000000001,Not Specified,4722,1328,6050
728387165835677696,https://pbs.twimg.com/media/ChvAQuMWMAAVaKD.jpg,1,Collie,26.641399999999997,2016-05-06 00:53:27,"This is Enchilada (yes, that's her real name). She's a Low-Cruisin Plopflopple. Very rare. Only a few left. 12/10 https://t.co/SiaiTWgsfP",https://twitter.com/dog_rates/status/728387165835677696/photo/1,Enchilada,120.0,Not Specified,3999,1075,5074
728751179681943552,https://pbs.twimg.com/media/Ch0LVPdW0AEdHgU.jpg,1,Saint Bernard,48.205,2016-05-07 00:59:55,This is Flurpson. He can't believe it's not butter. 10/10 https://t.co/XD3ort1PsE,https://twitter.com/dog_rates/status/728751179681943552/photo/1,Flurpson,100.0,Not Specified,3032,757,3789
728760639972315136,https://pbs.twimg.com/media/Ch0T71OWMAA4yIw.jpg,1,Pembroke,93.9134,2016-05-07 01:37:30,"When you're way too slow for the ""down low"" portion of a high five. 13/10 https://t.co/Cofwoy7Vpq","https://twitter.com/dog_rates/status/728760639972315136/photo/1,https://twitter.com/dog_rates/status/728760639972315136/photo/1",No Name,130.0,Not Specified,5090,1911,7001
728986383096946689,https://pbs.twimg.com/media/Ch3hOGWUYAE7w0y.jpg,2,Maltese Dog,95.207,2016-05-07 16:34:32,"This is Puff. He started out on the streets (first pic), but don't let the new smile fool you, still tough af. 11/10 https://t.co/kiuXRXcg4B","https://twitter.com/dog_rates/status/728986383096946689/photo/1,https://twitter.com/dog_rates/status/728986383096946689/photo/1",Puff,110.00000000000001,Not Specified,3460,917,4377
729463711119904772,https://pbs.twimg.com/media/Ch-TXpFXAAAwPGf.jpg,1,German Shepherd,82.9307,2016-05-09 00:11:16,Meet Pupcasso. You can't afford his art. 13/10 talented af https://t.co/f2VUpy4WO0,https://twitter.com/dog_rates/status/729463711119904772/photo/1,Pupcasso,130.0,Not Specified,6340,2586,8926
729823566028484608,https://pbs.twimg.com/media/CiDap8fWEAAC4iW.jpg,1,Kelpie,21.840799999999998,2016-05-10 00:01:12,This is Stefan. He's a downright remarkable pup. 13/10 https://t.co/Ebjt6Y4fMh,https://twitter.com/dog_rates/status/729823566028484608/photo/1,Stefan,130.0,Not Specified,4358,1390,5748
730211855403241472,https://pbs.twimg.com/media/CiI7zVZUoAEzGW7.jpg,1,Pug,34.1663,2016-05-11 01:44:07,This is Ziva. She doesn't know how her collar works. 11/10 would totally fix for her https://t.co/K7pthJXjWE,https://twitter.com/dog_rates/status/730211855403241472/photo/1,Ziva,110.00000000000001,Not Specified,4180,1182,5362
730427201120833536,https://pbs.twimg.com/media/CiL_qh0W0AAu5VA.jpg,1,Eskimo Dog,68.20819999999999,2016-05-11 15:59:50,This is Crystal. She's flawless. Really wants to be a frat bro. 11/10 who does she even know here? https://t.co/WyqNFvEulG,https://twitter.com/dog_rates/status/730427201120833536/photo/1,Crystal,110.00000000000001,Not Specified,3809,1176,4985
730573383004487680,https://pbs.twimg.com/media/CiOEnI6WgAAmq4E.jpg,2,American Staffordshire Terrier,81.0158,2016-05-12 01:40:42,This is Rooney. He can't comprehend glass. 10/10 it'll be ok pupper https://t.co/CnUl2uDBBV,"https://twitter.com/dog_rates/status/730573383004487680/photo/1,https://twitter.com/dog_rates/status/730573383004487680/photo/1,https://twitter.com/dog_rates/status/730573383004487680/photo/1",Rooney,100.0,pupper,5407,2435,7842
731285275100512256,https://pbs.twimg.com/media/CiYME3tVAAENz99.jpg,1,Pembroke,96.7103,2016-05-14 00:49:30,This is Solomon. He's a Beneroo Cumberflop. 12/10 would hug passionately https://t.co/5phLAnGPTP,https://twitter.com/dog_rates/status/731285275100512256/photo/1,Solomon,120.0,Not Specified,3798,1090,4888
732005617171337216,https://pbs.twimg.com/media/CiibOMzUYAA9Mxz.jpg,1,English Setter,67.74080000000001,2017-01-02 20:12:21,RT @dog_rates: This is Larry. He has no self control. Tongue still nifty af tho 11/10 https://t.co/ghyT4Ubk1r,"https://twitter.com/dog_rates/status/732005617171337216/photo/1,https://twitter.com/dog_rates/status/732005617171337216/photo/1,https://twitter.com/dog_rates/status/732005617171337216/photo/1,https://twitter.com/dog_rates/status/732005617171337216/photo/1",Larry,110.00000000000001,Not Specified,16324,6154,22478
732585889486888962,https://pbs.twimg.com/media/Ciqq-VFUUAANlWm.jpg,2,Staffordshire Bullterrier,84.3359,2016-05-17 14:57:41,"When your teacher agreed on 10,000 RTs and no final but after 24 hours you only have 37... 10/10 https://t.co/sVnJfWVjUp","https://twitter.com/dog_rates/status/732585889486888962/photo/1,https://twitter.com/dog_rates/status/732585889486888962/photo/1",No Name,100.0,Not Specified,4016,868,4884
732726085725589504,https://pbs.twimg.com/media/CisqdVcXEAE3iW7.jpg,1,Pomeranian,96.1902,2016-05-18 00:14:46,This is Aldrick. He looks wise af. Also exceptionally fluffy. Only two legs tho (unfortunate). 11/10 would still hug https://t.co/QwiCVLPMNL,https://twitter.com/dog_rates/status/732726085725589504/photo/1,Aldrick,110.00000000000001,Not Specified,3855,1003,4858
733109485275860992,https://pbs.twimg.com/media/CiyHLocU4AI2pJu.jpg,1,Golden Retriever,94.5523,2016-09-14 03:27:11,"RT @dog_rates: Like father (doggo), like son (pupper). Both 12/10 https://t.co/pG2inLaOda","https://twitter.com/dog_rates/status/733109485275860992/photo/1,https://twitter.com/dog_rates/status/733109485275860992/photo/1",No Name,120.0,doggo,44619,17621,62240
733460102733135873,https://pbs.twimg.com/media/Ci3GDeyUoAAKOxn.jpg,1,Chow,93.1275,2016-05-20 00:51:30,This is Hermione. Her face is as old as time. Appears fluffy af tho. 11/10 pretty damn majestic https://t.co/0b41Q4DKCA,https://twitter.com/dog_rates/status/733460102733135873/photo/1,Hermione,110.00000000000001,Not Specified,4605,1451,6056
733482008106668032,https://pbs.twimg.com/media/Ci3Z_idUkAA8RUh.jpg,1,French Bulldog,61.9382,2016-05-20 02:18:32,"""Ello this is dog how may I assist"" ...10/10 https://t.co/jeAENpjH7L",https://twitter.com/dog_rates/status/733482008106668032/photo/1,No Name,100.0,Not Specified,3438,1065,4503
733822306246479872,https://pbs.twimg.com/media/Ci8Pfg_UUAA2m9i.jpg,1,Lhasa,45.7356,2016-05-21 00:50:46,This is Moose. He's a Polynesian Floofer. Dapper af. 10/10 would pet diligently https://t.co/mVfqRdppTL,https://twitter.com/dog_rates/status/733822306246479872/photo/1,Moose,100.0,floofer,4015,1141,5156
733828123016450049,https://pbs.twimg.com/media/Ci8UxxcW0AYgHDh.jpg,2,Beagle,47.232400000000005,2016-05-21 01:13:53,This is Terry. The harder you hug him the farther his tongue sticks out. 10/10 magical af https://t.co/RFToQQI8fJ,"https://twitter.com/dog_rates/status/733828123016450049/photo/1,https://twitter.com/dog_rates/status/733828123016450049/photo/1",Terry,100.0,Not Specified,3926,881,4807
734776360183431168,https://pbs.twimg.com/media/CjJzMlBUoAADMLx.jpg,1,Siberian Husky,30.4902,2016-05-23 16:01:50,This is Livvie. Someone should tell her it's been 47 years since Woodstock. Magical eyes tho 11/10 would stare into https://t.co/qw07vhVHuO,https://twitter.com/dog_rates/status/734776360183431168/photo/1,Livvie,110.00000000000001,Not Specified,2742,608,3350
734787690684657664,https://pbs.twimg.com/media/CjJ9gQ1WgAAXQtJ.jpg,4,Golden Retriever,88.3991,2016-05-23 16:46:51,This dog is more successful than I will ever be. 13/10 absolute legend https://t.co/BPoaHySYwA,"https://twitter.com/dog_rates/status/734787690684657664/photo/1,https://twitter.com/dog_rates/status/734787690684657664/photo/1,https://twitter.com/dog_rates/status/734787690684657664/photo/1,https://twitter.com/dog_rates/status/734787690684657664/photo/1",No Name,130.0,Not Specified,13745,7102,20847
734912297295085568,https://pbs.twimg.com/media/CjLuzPvUoAAbU5k.jpg,1,Maltese Dog,84.7292,2016-05-24 01:02:00,This is Jax. He's a literal fluffball. Sneaky tongue slip. 10/10 would pet nonstop https://t.co/9MGouPwQmK,https://twitter.com/dog_rates/status/734912297295085568/photo/1,Jax,100.0,Not Specified,2993,572,3565
735137028879360001,https://pbs.twimg.com/media/CjO7OfeWgAAUQy-.jpg,1,Walker Hound,41.3535,2016-05-24 15:55:00,Meet Buckley. His family &amp; some neighbors came over to watch him perform but he's nervous af. 9/10 u got this pupper https://t.co/5bdCpPlno9,https://twitter.com/dog_rates/status/735137028879360001/photo/1,Buckley,90.0,pupper,3428,1092,4520
735256018284875776,https://pbs.twimg.com/media/CjQnclkVEAA4pnK.jpg,1,Staffordshire Bullterrier,52.3191,2016-05-24 23:47:49,This is Kellogg. He accidentally opened the front facing camera. 8/10 get it together doggo https://t.co/MRYv7nDPyS,https://twitter.com/dog_rates/status/735256018284875776/photo/1,Kellogg,80.0,doggo,3675,993,4668
735635087207878657,https://pbs.twimg.com/media/CjWANBlVAAAaN-a.jpg,1,Pug,89.18709999999999,2016-05-26 00:54:06,This is Dakota. He hasn't grow into his skin yet. 11/10 would squeeze softly https://t.co/IvFSlNXpgj,"https://twitter.com/dog_rates/status/735635087207878657/photo/1,https://twitter.com/dog_rates/status/735635087207878657/photo/1",Dakota,110.00000000000001,Not Specified,6776,2659,9435
735648611367784448,https://pbs.twimg.com/media/CjWMezdW0AErwU3.jpg,1,Pembroke,46.2594,2016-05-26 01:47:51,*faints* 12/10 perfection in pupper form https://t.co/t6TxTwTLEK,https://twitter.com/dog_rates/status/735648611367784448/photo/1,No Name,120.0,pupper,4397,1237,5634
735991953473572864,https://pbs.twimg.com/media/CjbExRKUoAAs089.jpg,2,Cocker Spaniel,96.1643,2016-05-27 00:32:10,This is Maxaroni. He's curly af. Also rather fabulous. 11/10 would hug well https://t.co/A216OjIdca,"https://twitter.com/dog_rates/status/735991953473572864/photo/1,https://twitter.com/dog_rates/status/735991953473572864/photo/1,https://twitter.com/dog_rates/status/735991953473572864/photo/1",Maxaroni,110.00000000000001,Not Specified,3934,1283,5217
736010884653420544,https://pbs.twimg.com/media/CjbV-lEWgAAr6WY.jpg,2,Golden Retriever,55.3901,2016-05-27 01:47:23,Right after you graduate vs when you remember you're on your own now and can barely work a washing machine ...10/10 https://t.co/O1TLuYjsNS,"https://twitter.com/dog_rates/status/736010884653420544/photo/1,https://twitter.com/dog_rates/status/736010884653420544/photo/1",No Name,100.0,Not Specified,8652,3355,12007
736736130620620800,https://pbs.twimg.com/media/CjlpmZaUgAED54W.jpg,1,Schipperke,54.550200000000004,2016-05-29 01:49:16,This is Chadrick. He's gnarly af 13/10 https://t.co/447tyBN0mW,https://twitter.com/dog_rates/status/736736130620620800/photo/1,Chadrick,130.0,Not Specified,4736,1972,6708
737445876994609152,https://pbs.twimg.com/media/CjvvHBwUoAE55WZ.jpg,1,Samoyed,40.056799999999996,2016-05-31 00:49:32,Just wanted to share this super rare Rainbow Floofer in case you guys haven't seen it yet. 13/10 colorful af https://t.co/CaG9MzD3WT,https://twitter.com/dog_rates/status/737445876994609152/photo/1,No Name,130.0,floofer,11302,5048,16350
737800304142471168,https://pbs.twimg.com/media/Cj0xdMBVAAEbDHp.jpg,1,Malamute,37.4682,2016-06-01 00:17:54,This is Bella. She's ubering home after a few too many drinks. 10/10 socially conscious af https://t.co/KxkOgq80Xj,https://twitter.com/dog_rates/status/737800304142471168/photo/1,Bella,100.0,Not Specified,10943,3904,14847
737826014890496000,https://pbs.twimg.com/media/Cj1I1fbWYAAOwff.jpg,1,Vizsla,99.0391,2016-06-01 02:00:04,This is Remy. He has some long ass ears (probably magical). Also very proud of broken stick. 10/10 such a good boy https://t.co/EZx0YjPjPK,"https://twitter.com/dog_rates/status/737826014890496000/photo/1,https://twitter.com/dog_rates/status/737826014890496000/photo/1",Remy,100.0,Not Specified,5757,2006,7763
738156290900254721,https://pbs.twimg.com/media/Cj51Oj3VAAEVe4O.jpg,1,Pug,75.17580000000001,2016-06-01 23:52:28,This is Storkson. He's wet and sad. 10/10 cheer up pup https://t.co/nrzvzPuTvC,https://twitter.com/dog_rates/status/738156290900254721/photo/1,Storkson,100.0,Not Specified,2768,748,3516
738166403467907072,https://pbs.twimg.com/media/Cj5-aUQUgAAb43p.jpg,2,Keeshond,87.88860000000001,2016-06-02 00:32:39,This is Axel. He's a professional leaf catcher. 12/10 gifted af https://t.co/P8bgOMMTRs,"https://twitter.com/dog_rates/status/738166403467907072/photo/1,https://twitter.com/dog_rates/status/738166403467907072/photo/1,https://twitter.com/dog_rates/status/738166403467907072/photo/1,https://twitter.com/dog_rates/status/738166403467907072/photo/1",Axel,120.0,Not Specified,9635,3828,13463
738402415918125056,https://pbs.twimg.com/media/Cj9VEs_XAAAlTai.jpg,1,Cocker Spaniel,34.6695,2016-06-02 16:10:29,"""Don't talk to me or my son ever again"" ...10/10 for both https://t.co/s96OYXZIfK",https://twitter.com/dog_rates/status/738402415918125056/photo/1,No Name,100.0,Not Specified,3599,955,4554
738537504001953792,https://pbs.twimg.com/media/Cj_P7rSUgAAYQbz.jpg,1,Chow,80.8737,2016-06-03 01:07:16,This is Bayley. She fell asleep trying to escape her evil fence enclosure. 11/10 night night puppo https://t.co/AxSiqAKEKu,"https://twitter.com/dog_rates/status/738537504001953792/photo/1,https://twitter.com/dog_rates/status/738537504001953792/photo/1",Bayley,110.00000000000001,puppo,5575,1759,7334
738883359779196928,https://pbs.twimg.com/media/CkEKe3QWYAAwoDy.jpg,2,Labrador Retriever,69.1137,2016-06-04 00:01:35,When a single soap orb changes your entire perception of the universe... 10/10 https://t.co/9eCXpVExJc,"https://twitter.com/dog_rates/status/738883359779196928/photo/1,https://twitter.com/dog_rates/status/738883359779196928/photo/1",No Name,100.0,Not Specified,3661,917,4578
739238157791694849,https://pbs.twimg.com/ext_tw_video_thumb/739238016737267712/pu/img/-tLpyiuIzD5zR1et.jpg,1,Eskimo Dog,50.3372,2016-08-30 22:04:05,RT @dog_rates: Here's a doggo blowing bubbles. It's downright legendary. 13/10 would watch on repeat forever (vid by Kent Duryee) https://t…,https://twitter.com/dog_rates/status/739238157791694849/video/1,No Name,130.0,doggo,75163,52360,127523
739606147276148736,https://pbs.twimg.com/media/CkOb3FXW0AAUL_U.jpg,3,Blenheim Spaniel,93.3755,2016-06-05 23:53:41,Meet Benji. He just turned 1. Has already given up on a traditional pupper physique. Just inhaled that thing. 9/10 https://t.co/sLUC4th3Zj,"https://twitter.com/dog_rates/status/739606147276148736/photo/1,https://twitter.com/dog_rates/status/739606147276148736/photo/1,https://twitter.com/dog_rates/status/739606147276148736/photo/1",Benji,90.0,pupper,5897,1876,7773
739844404073074688,https://pbs.twimg.com/media/CkR0jrhWYAALL5N.jpg,1,Toy Poodle,34.2397,2016-06-06 15:40:26,This is Simba. He's the grand prize. The trophy is just for participation. 12/10 would pet so damn well https://t.co/4qiuC0lXq5,https://twitter.com/dog_rates/status/739844404073074688/photo/1,Simba,120.0,Not Specified,4138,966,5104
